asin,title,price,rating,num_reviews,img_link
B081SCKXZQ,"Válquer Profesional Oxidante en Crema 20 Vol (6%), Agua oxigenada para tintes, Coloración capilar permanente - 75 ml",0.95,4.5,5.579,"https://images-eu.ssl-images-amazon.com/images/I/41DhGwOPt9L._AC_UL900_SR900,600_.jpg"
B00WN2BY7G,"Vichy, Champú anti-caspa Decros Technique (cabellos norma/graso) - 390 ml.",18.20,4.6,5.468,"https://images-eu.ssl-images-amazon.com/images/I/61z7pU1eTbL._AC_UL900_SR900,600_.jpg"
B09WH2BXSH,"Natulim - Detergente en Tiras para Lavadora (40 Lavados) - Incluye efecto Suavizante, Ecológico, Hipoalergénico - Ropa limpia",11.95,4.2,2.007,"https://images-eu.ssl-images-amazon.com/images/I/61o6CE2t9gL._AC_UL900_SR900,600_.jpg"
B08J3TFBKR,Incapto Café en Grano de Especialidad | Origen Colombia | 100% Arábica | Specialty Coffee 84 puntos SCA | Tueste Natural y Ar,18.85,4.2,517,"https://images-eu.ssl-images-amazon.com/images/I/61oJ8AQR8QL._AC_UL900_SR900,600_.jpg"
B0BBQ4JYKC,"Pistola de Masaje Muscular, ALDOM Pistola Masaje Pistola Masajeadora Muscular Profesional Massage Gun y Carga Tipo-C, 30 Velo",109.99,4.3,8.459,"https://images-eu.ssl-images-amazon.com/images/I/71IQgbGE3+L._AC_UL900_SR900,600_.jpg"
B07TT7VMFD,Ducray Champu Anticaspa-100 milliliters,0,4.5,1.011,"https://images-eu.ssl-images-amazon.com/images/I/71fM+c7LPWL._AC_UL900_SR900,600_.jpg"
B08H2G67JK,"OULAC Pintalabios Oro Desnudo Metálico, Brillo 3D De larga duración, Barras de Labios Muy Pigmentadas, Cobertura Total, 4.3 g",6.39,4.0,8.437,"https://images-eu.ssl-images-amazon.com/images/I/71mCKUb2n2L._AC_UL900_SR900,600_.jpg"
B07P2D25CW,"SINOPHANT Leggins Mujer, Pantalon Yoga Mujer, Mallas Deporte Mujer, Leggings Mujer Suaves Elásticos de Cintura Alta Tallas Gr",11.99,4.2,51.821,"https://images-eu.ssl-images-amazon.com/images/I/51QYOo+dhUS._AC_UL900_SR900,600_.jpg"
B000Z971W6,Salus - Floradix Suplemento de Hierro Líquido - 500 ml - Reduce el Cansancio y la Fatiga - Contiene Hierro Orgánico y Vitamin,22.99,4.3,10.115,"https://images-eu.ssl-images-amazon.com/images/I/71k3ENwVpWL._AC_UL900_SR900,600_.jpg"
B09FPKX5Z8,"ORSEN Tableta de Escritura LCD 8,5 Pulgadas, Tablero de Dibujo Electrónico, Pizarra Infantil Juguetes de Dinosaurio Regalo de",14.94,4.5,5.204,"https://images-eu.ssl-images-amazon.com/images/I/61OWTDHny6L._AC_UL900_SR900,600_.jpg"
B07HRW5W4D,Valquer Profesional - Válquer Oxigenada para Tintes Capilares Premium Ultra-Cremoso 20 Vol (6%) 1000 ml,8.79,4.6,1.109,"https://images-eu.ssl-images-amazon.com/images/I/71SjMEw40hL._AC_UL900_SR900,600_.jpg"
B09ZPQ662Q,"XIXVON Paraguas Pro | UPF 50+ 99% De ProteccióN UV, Banda De Seguridad Reflectante, Resistente Al Viento, PortáTil, AutomáTic",37.00,4.3,2.212,"https://images-eu.ssl-images-amazon.com/images/I/613TD51k8lL._AC_UL900_SR900,600_.jpg"
B073WW3XZ2,"Valquer Laboratorios - Valquer Gel Conductor Corporal & Facial - Para aparatología profesional (ultrasonidos, electroterapia,",9.75,4.4,3.664,"https://images-eu.ssl-images-amazon.com/images/I/61hTa3DwwXS._AC_UL900_SR900,600_.jpg"
B082DK377L,"Apple iPhone 11, 64GB, Blanco (Reacondicionado)",326.00,4.0,630,"https://images-eu.ssl-images-amazon.com/images/I/71Rp3gUyJUL._AC_UL900_SR900,600_.jpg"
B07HRY2PXN,Valquer Profesional Oxigenada Premium Ultra-Cremosa 40 Vol (12%). Agua oxigenada para tintes. coloración capilar permanente -,8.95,4.6,1.153,"https://images-eu.ssl-images-amazon.com/images/I/71OZSGd7YFL._AC_UL900_SR900,600_.jpg"
B015SWZYOQ,Valquer Champú de cebolla. Reduce la grasa. Estimulante capilar. Antioxidante cabello. Purificante. Todo tipo de cabello. Ace,13.50,4.3,1.520,"https://images-eu.ssl-images-amazon.com/images/I/41tqlHhiFBL._AC_UL900_SR900,600_.jpg"
B0B57XTL2D,"LAOBEN masajeador con 20 velocidades regulables y 6 cabezales, pistola de masaje muscular para relajar los músculos y aliviar",29.99,4.0,179,"https://images-eu.ssl-images-amazon.com/images/I/61Bp2hRLd3L._AC_UL900_SR900,600_.jpg"
B084S5J95Q,Valquer Profesional Champú Revitalizante con pH Neutro y Pro-Vitamina B5 - 1000 ml,9.50,4.1,303,"https://images-eu.ssl-images-amazon.com/images/I/51RuMe6-A5L._AC_UL900_SR900,600_.jpg"
B000GSYRAA,"KLORANE - KLORANE Champú al Extracto de Quinina, 400 ml, unisex",14.95,4.5,3.220,"https://images-eu.ssl-images-amazon.com/images/I/61OR4bV0PkL._AC_UL900_SR900,600_.jpg"
B074CRFKRS,"Valquer Profesional Champú Reparador para Cabellos Dañados - Sin Sulfatos, Sin Parabenos, Sin Siliconas y Sin Sal - 1000 Mili",26.95,4.3,2.219,"https://images-eu.ssl-images-amazon.com/images/I/71DXwFnyJNL._AC_UL900_SR900,600_.jpg"
B086J978R1,"OSTBA - Cortafiambres Eléctrico OSTBA, Maquina de Cortar Fiambre, 150W, Cuchillas de Acero Inoxidable, Sistema Protector de M",69.99,4.1,610,"https://images-eu.ssl-images-amazon.com/images/I/61tyym3rniL._AC_UL900_SR900,600_.jpg"
B08HZFC9KB,Incapto Café Descafeinado en Grano | Selección de cafés 100% Arábica de Brasil | Proceso Swiss Water - Descafeinización Natur,34.95,4.2,194,"https://images-eu.ssl-images-amazon.com/images/I/610XeWH4d1L._AC_UL900_SR900,600_.jpg"
B08T19GT85,"La Roche-Posay Protección ultravioleta, Antiedad Anthelios Age Correct Spf50 Tubo 50Ml",25.99,4.5,473,"https://images-eu.ssl-images-amazon.com/images/I/51R8ioCsWTL._AC_UL900_SR900,600_.jpg"
B083DFKN5Q,"MAS CARNEY 【Paquete de 2】 WH6 Auriculares con Cable de 3.5 mm, Audifonos con Cable con Control de Volumen y Micrófono, Cascos",9.99,4.0,3.065,"https://images-eu.ssl-images-amazon.com/images/I/61LRZbYiD4L._AC_UL900_SR900,600_.jpg"
B08JCSRVGS,"Oulac 2 in 1 Pintalabios y Bálsamo Labial Rojo- Pintalabios Brillante Hidratante, Enriquecido Con Aceite de Rosa,Acabado Bril",6.38,3.9,1.247,"https://images-eu.ssl-images-amazon.com/images/I/71bpi+0MdML._AC_UL900_SR900,600_.jpg"
B074CRFZ72,"Valquer Profesional - Válquer Profesional Champú Anticaspa Zero % Sin Sal, Sin Sulfatos, Sin Parabenos y Sin Siliconas, Elimi",21.86,4.1,204,"https://images-eu.ssl-images-amazon.com/images/I/712-+npcKVL._AC_UL900_SR900,600_.jpg"
B074CQSTYZ,"Valquer Profesional Champú Antigrasa zero%: sin sal, sin sulfatos, sin parabenos y sin siliconas. Para cabellos grasos, regul",26.95,4.1,426,"https://images-eu.ssl-images-amazon.com/images/I/51WjGAPKwsL._AC_UL900_SR900,600_.jpg"
B096VDK8NV,Grefay Soporte Movil Moto Soporte Movil Scooter Desmontaje Rápido 1S Soportes Teléfono Espejo Retrovisor Motocicleta con 360 ,19.99,4.4,2.787,"https://images-eu.ssl-images-amazon.com/images/I/71b9z4amonS._AC_UL900_SR900,600_.jpg"
B00UNHHBQG,"VICHY DESOD ANTI TRAN ROLLON50, Crema, Fresco",7.49,4.7,903,"https://images-eu.ssl-images-amazon.com/images/I/61W5lvAb34L._AC_UL900_SR900,600_.jpg"
B0BX9Z68F2,"Jelly Pills® Gominolas de Melatonina 1,9 mg, Ashwagandha, Triptófano y Vitamina B6 y B12- Sin Azúcares Añadidos - 70 Gummies ",15.99,3.8,63,"https://images-eu.ssl-images-amazon.com/images/I/61OkvOU3wnL._AC_UL900_SR900,600_.jpg"
B083LLLVPN,"BroadLink RM4 Pro IR y RF Mando a Distancia WiFi Universal, para el hogar Inteligente y Dispositivos de Entretenimiento - par",48.99,4.2,7.351,"https://images-eu.ssl-images-amazon.com/images/I/51bCuEYuLkL._AC_UL300_SR300,200_.jpg"
B08PCDKD6G,"Apple iPhone 12 mini, 128GB, Negro - (Reacondicionado)",374.88,3.7,2.565,"https://images-eu.ssl-images-amazon.com/images/I/71uuDYxn3XL._AC_UL300_SR300,200_.jpg"
B0B2QPDH3B,"MAS CARNEY Auriculares Internos con Cable USB C TI3, Microfono para Samsung, Huawei, OPPO, Honor, Google Pixel y Otros Teléfo",7.99,3.8,1.386,"https://images-eu.ssl-images-amazon.com/images/I/61zakThMFnL._AC_UL300_SR300,200_.jpg"
B0BHYXG2GH,"Rwest X Medias de Compresion, Calcetines de compresión Mujer y Hombre 18 mmHg para Running,Ciclismo, Deporte, Trotar, Correr,",11.99,4.4,12.677,"https://images-eu.ssl-images-amazon.com/images/I/71y6TuRvUYL._AC_UL300_SR300,200_.jpg"
B07PFQC229,"Valquer Profesional - Válquer Profesional Champú Zero Silver Platinum. Sin sulfatos, sal ni siliconas. Cabellos blancos, gris",22.92,4.3,1.307,"https://images-eu.ssl-images-amazon.com/images/I/71do-t-faSL._AC_UL300_SR300,200_.jpg"
B00004RFRU,"Bialetti - Moka Express: Icónica Cafetera Italiana para Espresso, Auténtico Café Italiano, Cafetera Moka 6 Tazas (270 Ml), Al",35.96,4.4,81.208,"https://images-eu.ssl-images-amazon.com/images/I/51+I23YIolL._AC_UL300_SR300,200_.jpg"
B0BGH66LGR,APOONABA Camisa Lino Hombre Manga Larga Color Sólido Shirts Casual Algodón Camisetas Elegante Coton Camisas con Botónes Regul,24.64,3.6,547,"https://images-eu.ssl-images-amazon.com/images/I/61Fkmpxp8eL._AC_UL300_SR300,200_.jpg"
B0C3YTH1PP,Jelly Pills® Gominolas Multivitaminas y Minerales Niños - Sin azúcares añadidos - 70 Gummies sabor Fresa - Todas las Vitamina,14.99,4.5,131,"https://images-eu.ssl-images-amazon.com/images/I/61aPOnFbohL._AC_UL300_SR300,200_.jpg"
B0C23XDKY3,"MAS CARNEY Auriculares USB C TH6, con Chip Digital Integrado, micrófono y Control Remoto, compatibles con Smartphones Samsung",7.99,3.7,360,"https://images-eu.ssl-images-amazon.com/images/I/513NDoHPUsL._AC_UL300_SR300,200_.jpg"
B07284W4SW,"Válquer Profesional Ice Hair Mask. Máscara Capilar Reparación Total efecto hielo. Sin sal, sin parabenos y sin sulfatos. Cabe",21.00,4.5,1.009,"https://images-eu.ssl-images-amazon.com/images/I/71OjelSGznL._AC_UL300_SR300,200_.jpg"
B00YSELDTG,Valquer Laboratorios - Cuidados Champú capilar de biotina y keratina. Champú fortalezedor con vitamina B7. Reduce la caida de,10.39,4.2,460,"https://images-eu.ssl-images-amazon.com/images/I/41XLavaxfRL._AC_UL300_SR300,200_.jpg"
B07289R2CL,"Válquer Profesional Champú Anticaída Zero % Sin Sal, Sin Sulfatos, Sin Parabenos y Sin Siliconas, Reducir Caída Cabello, Stop",26.95,4.4,233,"https://images-eu.ssl-images-amazon.com/images/I/71cC2c2hKcL._AC_UL300_SR300,200_.jpg"
B01HWD737K,"YEOUTH - Gel Exfoliante Facial de Ácido Glicólico | Contiene Retinol y Té Verde | Ideal para Arrugas, Acné y Manchas | Adecua",15.99,4.1,3.994,"https://images-eu.ssl-images-amazon.com/images/I/61iPDhjKqwL._AC_UL300_SR300,200_.jpg"
B08NJK5WWH,"Anmossi Bombillas LED E27,6000K Blanco Frio,1200Lm,12W Bombilla LED Maíz E27 Equivalente a 100W Incandescente Bombilla,No Reg",13.15,4.6,949,"https://images-eu.ssl-images-amazon.com/images/I/71K6VYnrS3S._AC_UL300_SR300,200_.jpg"
B09TVYV461,"Oulac Pintalabios Permanente Soft Mate Nude - Larga duración Labial rico y nutritivo Labiales, Acabado Cremoso Mate, Barra de",6.99,3.8,858,"https://images-eu.ssl-images-amazon.com/images/I/81ZGq0s6X0L._AC_UL300_SR300,200_.jpg"
B0B3TPT9CX,"MicróFono Karaoke,Microfono NiñA InaláMbrico Karaoke Bluetooth PortáTil Con Altavoz Para NiñOs Canta Partido Musica, MicróFon",15.99,4.6,1.281,"https://images-eu.ssl-images-amazon.com/images/I/81JiRsoPjyL._AC_UL300_SR300,200_.jpg"
B07HRYTMVW,"Válquer Premium Oxidante Ultra-Cremoso 30 Vol, 9%, 1000 ml",8.95,4.6,1.125,"https://images-eu.ssl-images-amazon.com/images/I/71BANFl+RyL._AC_UL300_SR300,200_.jpg"
B09XK7JHSK,"Easyworkz Diego Cafetera Italiana de Acero Inoxidable para Cocina de inducción,520 ml, 10-12 Tazas,Negro",69.99,4.4,2.098,"https://images-eu.ssl-images-amazon.com/images/I/61rvGQBySML._AC_UL300_SR300,200_.jpg"
B084S5J3R2,Valquer Laboratorios - Valquer Profesional Acondicionador capilar revitalizante con keratina natural. Bálsamo para el cabello,9.95,4.0,316,"https://images-eu.ssl-images-amazon.com/images/I/61X+UsfVnlL._AC_UL300_SR300,200_.jpg"
B06XZ9K244,Magilano SKYJO Juego de Cartas definitivo para niños y Adultos.,15.95,4.8,54.484,"https://images-eu.ssl-images-amazon.com/images/I/91M6f+fWW+L._AC_UL300_SR300,200_.jpg"
B01KJQ7IVI,"ThinOptics Gafas De Lectura Con Estuche Para Llavero - Unisexo Hombres Mujeres - Gafas De Lectura Compactas, Plegables Y Livi",19.99,4.3,1.226,"https://images-eu.ssl-images-amazon.com/images/I/51pj2QXrKcL._AC_UL900_SR900,600_.jpg"
B07DGJZ91H,Valquer Profesional Protector Térmico Capilar. Spray. Protege el cabello del calor - 300 ml,8.60,3.9,402,"https://images-eu.ssl-images-amazon.com/images/I/716BDsK3o4L._AC_UL900_SR900,600_.jpg"
B07DPHG521,"Broadlink RM Mini3 - Control Remoto Universal para domótica, por Infrarrojos, función Wi-Fi, Color Negro",23.99,4.0,8.242,"https://images-eu.ssl-images-amazon.com/images/I/51+b+3TzFqL._AC_UL900_SR900,600_.jpg"
B0BGH66RQH,APOONABA Camisa Franela Hombre Manga Larga Cuadros Camisas Hombre Casual Shirts con Botón Vintage Franela Shirt Regular Fit,0,4.2,135,"https://images-eu.ssl-images-amazon.com/images/I/71svwgvQV5L._AC_UL900_SR900,600_.jpg"
B084YTF5RM,"DYNASONIC BL5C Batería Tipo para móvil, Altavoz, y Otros aparatos. Baterías Recargables de 1020mAh",8.99,4.0,632,"https://images-eu.ssl-images-amazon.com/images/I/61v-IrYA2YL._AC_UL900_SR900,600_.jpg"
B07429CJ8W,"Válquer Profesional Champú Fresco Ultrahidratante, Formulación 0 % Sin Sal, Sin Sulfatos, Sin Parabenos, Sin Colorantes y Sin",18.95,4.4,818,"https://images-eu.ssl-images-amazon.com/images/I/71BNeQfCHDL._AC_UL900_SR900,600_.jpg"
B09FN67MG6,"Jelly Pills® Gominolas de Biotina 5000 mcg, Ácido Fólico y 7 Vitaminas - Sin Azúcares Añadidos - 60 Gummies Veganas sabor Fra",15.99,4.2,249,"https://images-eu.ssl-images-amazon.com/images/I/613rgZogTZL._AC_UL900_SR900,600_.jpg"
B0C3YTL56S,"Jelly Pills® Gominolas de Melatonina y Vitamina B6 Niños - Sin Azúcares Añadidos - 0,5 mg dosis diaria para Dormir Bien - 70 ",14.99,4.6,159,"https://images-eu.ssl-images-amazon.com/images/I/61n1zlMBhaL._AC_UL900_SR900,600_.jpg"
B0086QEO7K,Tangle Teezer - Cepillo para el Pelo Original Panther Black,12.05,4.6,23.478,"https://images-eu.ssl-images-amazon.com/images/I/71N0MyiCokL._AC_UL900_SR900,600_.jpg"
B08HRPZXVG,"Válquer Profesional Champú Especial Rizos, Método Curly Girl, para Cabellos Rizados, Sin Sulfatos, Sin Sal, Vegano Cabello Ri",18.95,4.3,209,"https://images-eu.ssl-images-amazon.com/images/I/71YuRVohuDL._AC_UL900_SR900,600_.jpg"
B0BHMNF67W,"4UBonLife Funda para iPad 9,7 Pulgadas 6.ª/5.ª Generación 2018/2017, Cover Protectora Carcasa Rígida Delgada Ligera con Trase",10.99,4.5,405,"https://images-eu.ssl-images-amazon.com/images/I/617kTCcErwL._AC_UL900_SR900,600_.jpg"
B0866V21WT,"La Roche-Posay Purifican EFFACLAR MICROPEELING GEL DOSIFIC. 400ML PARA2, Negro, 400 ml (Paquete de 1), 400, 400 grams, 400 mi",0,4.7,5.305,"https://images-eu.ssl-images-amazon.com/images/I/71Y3+exGT1L._AC_UL900_SR900,600_.jpg"
B099BN55QY,Válquer Profesional Laboratorios Champú Sólido 2 En 1 Curly. 95% Ingredientes Naturales. Cabellos Rizado. Vegano. Repara E Hi,8.95,3.8,195,"https://images-eu.ssl-images-amazon.com/images/I/61izwYigHfL._AC_UL900_SR900,600_.jpg"
B06WVFPBNH,"Yinyoo KZ ZST Auriculares, Estructura balanceada + Driver Dual dinámico híbrido, Alta fidelidad, in-Ear",20.99,4.3,3.997,"https://images-eu.ssl-images-amazon.com/images/I/51j-gOgRiFL._AC_UL900_SR900,600_.jpg"
B084S8219G,Champú sólido Hemp (extracto de cannabis y aceite de cáñamo) - 50 G,8.00,4.4,300,"https://images-eu.ssl-images-amazon.com/images/I/81iAkA7yJ3L._AC_UL900_SR900,600_.jpg"
B09Q6DNDPN,"Valquer Profesional Booster Especial Rizos Perfectos, Método Curly Girl, para Cabellos Rizados, Sin Sulfatos, Sin Sal, Vegano",16.31,4.1,114,"https://images-eu.ssl-images-amazon.com/images/I/61cYrAZeBVL._AC_UL900_SR900,600_.jpg"
B09PLNBBVY,CROING Rodillo de pelusa recargable (720 hojas),11.99,4.1,380,"https://images-eu.ssl-images-amazon.com/images/I/71x6Ful2UcL._AC_UL900_SR900,600_.jpg"
B00C0I7Z58,"Bioderma Photoderm Ar Spf 50+ Uva 33, Normal",16.36,4.4,848,"https://images-eu.ssl-images-amazon.com/images/I/51n9DOD-KkL._AC_UL900_SR900,600_.jpg"
B013BFZLNG,Alfaparf Semi Di Lino Diamond Cristalli Liquidi Instant Illuminating Serum 50ml 1.69oz by AlfaParf,20.33,4.7,1.883,"https://images-eu.ssl-images-amazon.com/images/I/618mH-p7uYL._AC_UL900_SR900,600_.jpg"
B09ZPP8FHR,"XIXVON Paraguas Plus | UPF 50+ 99% De ProteccióN UV, Eje De Metal Fuerte, Resistente Al Viento, PortáTil | Paraguas Plegable ",58.00,4.4,798,"https://images-eu.ssl-images-amazon.com/images/I/41SHv0VJVDL._AC_UL900_SR900,600_.jpg"
B08J45ZQHM,"Pintalabios Permanente Mate de Larga Duración-Oulac Violeta Barra de Labios Líquido Hasta 12 horas, Mágico, Resistente al Agu",7.99,3.4,1.799,"https://images-eu.ssl-images-amazon.com/images/I/616X5J8FSdL._AC_UL900_SR900,600_.jpg"
B0C242LN3T,"MAS CARNEY Auriculares USB C TH6, con Chip Digital Integrado, micrófono y Control Remoto, compatibles con Smartphones Samsung",11.99,3.7,360,"https://images-eu.ssl-images-amazon.com/images/I/61qsnUP9qjL._AC_UL900_SR900,600_.jpg"
B09CL79J9F,"Srhythm NiceComfort 95 Auriculares Híbridos con Cancelación de Ruido, Auriculares Bluetooth Inalámbricos con Modo de Transpar",59.55,4.2,510,"https://images-eu.ssl-images-amazon.com/images/I/61Bbew3xXpL._AC_UL900_SR900,600_.jpg"
B08TJ2LGB8,Apple AirPods Pro (1.ª Generación) (Reacondicionado),185.00,3.7,603,"https://images-eu.ssl-images-amazon.com/images/I/71eGsUPZm2L._AC_UL900_SR900,600_.jpg"
B07C8GM4H1,"Srhythm NC25 Auriculares Estéreo con Cancelación Activa de Ruido (ANC), Bluetooth 5.3, Circumaurales, con Alta Fidelidad, Mic",65.99,4.4,13.525,"https://images-eu.ssl-images-amazon.com/images/I/61h8tZdnksL._AC_UL900_SR900,600_.jpg"
B0C16ZBHVK,"MAS CARNEY WH6 - Auriculares con Cable Semi in-Ear, Cable de Auriculares con Cable 3.5, para MP3/MP4, iPad, Honor 6X/7X/8X/8X",6.99,4.0,3.065,"https://images-eu.ssl-images-amazon.com/images/I/51f6+AoOZ2L._AC_UL900_SR900,600_.jpg"
B082P6M3HC,"Apple iPhone 11, 64GB, Negro (Reacondicionado)",324.99,3.8,2.798,"https://images-eu.ssl-images-amazon.com/images/I/61cnmobWl4L._AC_UL900_SR900,600_.jpg"
B09DQCKRW6,Valquer Laboratorios Acondicionador Bifásico Preventivo Infantil Escolar. Preventivo Piojos. Con Aceite De Árbol De Té. Preve,12.77,4.6,26,"https://images-eu.ssl-images-amazon.com/images/I/71IZ3EukrsL._AC_UL900_SR900,600_.jpg"
B0BG5MQ5BG,Jelly Pills® Gominolas de Colágeno Hidrolizado Ácido Hialurónico Coenzima Q10 y Vitamina C - Sin azúcares añadidos - 60 gummi,16.99,4.0,153,"https://images-eu.ssl-images-amazon.com/images/I/61oDJGSybUL._AC_UL900_SR900,600_.jpg"
B0872PPSGM,"BroadLink RM4 Mini Smart Remote y Juego de Cables con Sensor de Monitor de Temperatura y Humedad, Compatible con Alexa, IFTTT",36.99,4.2,2.668,"https://images-eu.ssl-images-amazon.com/images/I/61BbWXPaHGL._AC_UL900_SR900,600_.jpg"
B074CRFKRT,"Válquer Profesional - Champú Potenciador Color y Brillo, Formulación Zero % Sin Sal, Sin Sulfatos, Sin Parabenos y Sin Silico",26.97,4.3,168,"https://images-eu.ssl-images-amazon.com/images/I/71SCNmYjJsL._AC_UL300_SR300,200_.jpg"
B00OJ9BDHW,ThinOptics Gafas De Lectura Estuche Compacto Universal - Unisexo Hombres Mujeres - Gafas De Lectura Compactas Y Livianas Con ,19.99,4.4,1.815,"https://images-eu.ssl-images-amazon.com/images/I/61S6eiMkzdL._AC_UL300_SR300,200_.jpg"
B07KPBXZFC,"Aourow Lámpara de Espejo Baño LED 5W 230V 500lm,a Prueba de Agua IP44 30cm,3 en 1,Fije en el Espejo +en el Gabinete+en la Par",20.43,4.4,9.157,"https://images-eu.ssl-images-amazon.com/images/I/615Y0Mi8hZS._AC_UL300_SR300,200_.jpg"
B08HRP6PQM,"Válquer Profesional Mascarilla Especial Rizos, Método Curly Girl, para Cabellos Rizados, Sin Sulfatos, Sin Sal, Vegano Cabell",30.42,4.0,108,"https://images-eu.ssl-images-amazon.com/images/I/712CmlabiIL._AC_UL300_SR300,200_.jpg"
B083S6Q8VK,"Srhythm NC25 Auriculares Estéreo con Cancelación Activa de Ruido (ANC), Bluetooth 5.3, Circumaurales, con Alta Fidelidad, Mic",69.99,4.4,13.525,"https://images-eu.ssl-images-amazon.com/images/I/61DtvpgVlOL._AC_UL300_SR300,200_.jpg"
B09HCGNH45,"DYNASONIC - (3ª Gen Altavoz Bluetooth Portatil con Modo Karaoke y Micrófono, Radio FM y Lector USB SD (Modelo 12, Luces Disco",55.73,4.2,3.150,"https://images-eu.ssl-images-amazon.com/images/I/71VGGqTwziL._AC_UL300_SR300,200_.jpg"
B08WJ88MHG,"Unik Detox Slim | Detoxifica y Depura el Organismo, Retención de Líquidos y Control de Peso | Cactínea + Cardo Mariano + Jeng",29.95,3.9,224,"https://images-eu.ssl-images-amazon.com/images/I/713aNcP97jL._AC_UL300_SR300,200_.jpg"
B004SBLR4U,"Vichy Dercos Estimulante Champú Complemento Anticaída, 400 ml",17.25,4.4,1.873,"https://images-eu.ssl-images-amazon.com/images/I/51mSjF1qGCL._AC_UL300_SR300,200_.jpg"
B09674F2X6,"Jlab Go Work, Auriculares Inalambricos con Microfono 45 Tiempo de Reproducción - Auriculares Inalambricos PC, Cascos con Micr",59.99,3.9,8.675,"https://images-eu.ssl-images-amazon.com/images/I/71BCccf31hL._AC_UL300_SR300,200_.jpg"
B07BZC65LL,"AlfaParf Semi Di Lino Moisture Nutritive Low Champú, Único, Cedro, 250 Mililitro",14.08,4.5,2.559,"https://images-eu.ssl-images-amazon.com/images/I/611nzhXKmHL._AC_UL300_SR300,200_.jpg"
B0BHLXFV1D,"4UBonLife Funda para iPad 9,7 Pulgadas 6.ª/5.ª Generación 2018/2017, Cover Protectora Carcasa Rígida Delgada Ligera con Trase",10.99,4.5,405,"https://images-eu.ssl-images-amazon.com/images/I/61gPFz5T9QL._AC_UL300_SR300,200_.jpg"
B000JTIX3S,Master Lock Caja fuerte para llaves [Mediana] [Montaje mural] - 5401EURD - Caja de seguridad,23.14,4.6,20.967,"https://images-eu.ssl-images-amazon.com/images/I/61yn62EWOPL._AC_UL300_SR300,200_.jpg"
B09J196ZV5,"AESHORY Aceites Esenciales para Humidificador, TOP26 x 5ML Aromaterapia de Aceite Esencial Naturale para Difusor, Cuidado de ",26.99,4.2,1.272,"https://images-eu.ssl-images-amazon.com/images/I/81StWBSRuVL._AC_UL300_SR300,200_.jpg"
B08397G44Z,"Aogled Lámpara de Espejo Baño 40 cm 10W 820LM 230V Blanco Frío 6000K,IP44 Clase II Lámpara de espejo de baño delgada,Abrazade",25.99,4.5,7.773,"https://images-eu.ssl-images-amazon.com/images/I/41XojIn6LsL._AC_UL300_SR300,200_.jpg"
B072SY5JHQ,Prueba de ADN de MyHeritage: Pruebas Genéticas de Antepasados y Etnicidad que abarcan más de 2.114 Regiones Geográficas y Coi,89.00,4.5,9.266,"https://images-eu.ssl-images-amazon.com/images/I/41GgMK-4I1L._AC_UL300_SR300,200_.jpg"
B00U2VQZDS,"Neutrogena Makeup Remover Cleansing Towelettes, 25 Count (Pack of 2) by Neutrogena",23.38,4.8,92.167,"https://images-eu.ssl-images-amazon.com/images/I/71PXjjbQCzL._AC_UL300_SR300,200_.jpg"
B07D92LYYM,"AlfaParf Semi Di Lino Sublime Essential Oil 12x13 Ml, Único, Aloe, 156 Mililitro",28.60,4.5,986,"https://images-eu.ssl-images-amazon.com/images/I/51a1LHD-opL._AC_UL300_SR300,200_.jpg"
B07DGK8YKW,"Valquer Profesional Acondicionador Bifásico Infantil. Zero%: sin sal, sin sulfatos. Acondicionador niños. For kids - 300 ml",14.95,4.5,172,"https://images-eu.ssl-images-amazon.com/images/I/41zhN5My6aL._AC_UL300_SR300,200_.jpg"
B089JV67PH,"Tru Niagen Suplemento NAD+ de ribósido de nicotinamida, para reducir el cansancio y la fatiga, fórmula patentada, 90 unidades",139.95,4.4,657,"https://images-eu.ssl-images-amazon.com/images/I/51HcPYCtADL._AC_UL300_SR300,200_.jpg"
B09KXM2CBT,Litherday Pantalones Chándal para Mujer Largo Algodón Pantalón Deportivo de Mujer Larga Pantalones de Deporte de Mujer con Bo,12.74,3.9,283,"https://images-eu.ssl-images-amazon.com/images/I/61WTKzYtp6L._AC_UL300_SR300,200_.jpg"
