asin,title,price,rating,num_reviews,img_link
B003UOYB8A,"Duracell - Pilas de botón de litio 2032 de 3 V, paquete de 2, Tecnología Baby Secure, uso en llaves con sensor magnético, bás",2.12,4.6,54.526,"https://images-eu.ssl-images-amazon.com/images/I/711+1JLHiuL._AC_UL900_SR900,600_.jpg"
B091G3WT74,"Amazon Fire TV Stick Lite con mando por voz Alexa | Lite (sin controles del TV), streaming HD",34.99,4.6,10.822,"https://images-eu.ssl-images-amazon.com/images/I/51NPmUNZn6L._AC_UL900_SR900,600_.jpg"
B08C1KN5J2,"Fire TV Stick con mando por voz Alexa (incluye controles del TV), dispositivo de streaming HD",44.99,4.6,52.125,"https://images-eu.ssl-images-amazon.com/images/I/81MjRfRR1nL._AC_UL900_SR900,600_.jpg"
B0CKZ7R5KT,"Echo Pop | Antracita, pack de 2 + Meross Smart Plug (enchufe inteligente WiFi), compatible con Alexa - Kit de inicio de Hogar",44.98,4.6,1.326,"https://images-eu.ssl-images-amazon.com/images/I/617G--VYsRL._AC_UL900_SR900,600_.jpg"
B0C5CH5QCY,"Reloj Inteligente Hombre Mujer, 1.85"" Smartwatch con Llamadas Bluetooth, Smart Watch Pulsómetro/Monitor de Sueño/Podómetro, 1",39.99,4.4,6.956,"https://images-eu.ssl-images-amazon.com/images/I/71s4mjiit3L._AC_UL900_SR900,600_.jpg"
B09WX9XBKD,"Te presentamos el Echo Pop | Altavoz inteligente wifi y Bluetooth con Alexa, de sonido potente y compacto | Antracita",39.98,4.6,1.326,"https://images-eu.ssl-images-amazon.com/images/I/613dEoF9-rL._AC_UL900_SR900,600_.jpg"
B07MLFBJG3,Amazon Basics - Pilas alcalinas AA de uso industrial (40 unidades),13.81,4.6,97.672,"https://images-eu.ssl-images-amazon.com/images/I/81FGpGF5kaL._AC_UL900_SR900,600_.jpg"
B0B92HXFYT,"Chromecast con Google TV (HD) - Reproduce contenido en streaming en el televisor con el mando de control por voz - Películas,",39.99,4.7,9.140,"https://images-eu.ssl-images-amazon.com/images/I/51qIuxdWalL._AC_UL900_SR900,600_.jpg"
B07XLML2YS,"TP-Link TAPO C200 - Cámara IP WiFi 360° Cámara de Vigilancia FHD 1080p,Visión nocturna, Notificaciones en tiempo real, Admite",29.99,4.6,100.900,"https://images-eu.ssl-images-amazon.com/images/I/61EnU6crOyL._AC_UL900_SR900,600_.jpg"
B00NTCHCU2,"Amazon Basics Pilas alcalinas AAA de 1,5 voltios, 20 Unidad, gama Performance (el aspecto puede variar)",7.66,4.5,1.369.803,"https://images-eu.ssl-images-amazon.com/images/I/71a+E3+Bc2L._AC_UL900_SR900,600_.jpg"
B0CLF7L361,"Echo Pop | Antracita, 2pack de + Philips Hue White Bombilla Inteligente (E27), compatible con Alexa - Kit de inicio de Hogar ",44.98,4.6,1.326,"https://images-eu.ssl-images-amazon.com/images/I/71rUHK2+z+L._AC_UL900_SR900,600_.jpg"
B007FD62FW,"Varta Pila de botón de litio de 3 V Electronics CR2025, pilas de botón en un blíster original de 2 unidades",1.19,4.6,139,"https://images-eu.ssl-images-amazon.com/images/I/61phmflcr+L._AC_UL900_SR900,600_.jpg"
B00LH3DMUO,"Amazon Basics Pilas alcalinas AAA de 1,5 voltios, gama Performance, Paquete de 36 (el aspecto puede variar)",12.18,4.5,1.369.803,"https://images-eu.ssl-images-amazon.com/images/I/611n29U6FsL._AC_UL900_SR900,600_.jpg"
B0C89CK95W,"Reloj Inteligente Mujer, 1.85"" Smartwatch Llamadas Bluetooth con Podómetro/Pulsómetro/Monitor de Sueño, 110+ Modos Deportivos",39.99,4.4,6.956,"https://images-eu.ssl-images-amazon.com/images/I/71qoQVetqhL._AC_UL900_SR900,600_.jpg"
B00NTCH52W,"Amazon Basics Pilas alcalinas AA de 1,5 voltios, 20 Unidad, gama Performance (el aspecto puede variar)",9.28,4.5,1.369.803,"https://images-eu.ssl-images-amazon.com/images/I/81ruqa5pXML._AC_UL900_SR900,600_.jpg"
B0CC25JW7F,Xiaomi Smartphone REDMI Note 12 8GB/256GB Dual Gris,185.00,4.3,70,"https://images-eu.ssl-images-amazon.com/images/I/61s3+FwLd-L._AC_UL900_SR900,600_.jpg"
B092C4P24Q,"CR2032, POWEROWL Pilas Botón CR2032 de Litio de 3V, DL2032/ KCR2032 / BR2032 / ECR2032 Baterías para Dispositivos Electrónico",6.79,4.5,3.687,"https://images-eu.ssl-images-amazon.com/images/I/71OMxuzIuAL._AC_UL900_SR900,600_.jpg"
B01MR82NFZ,"YI Cámara Vigilancia, Bebe Camara IP Wifi 1080p Sistema de Seguridad de Full HD, Detección de Movimiento, Visión Nocturna, Au",19.99,4.1,15.454,"https://images-eu.ssl-images-amazon.com/images/I/519Dw4tOd1S._AC_UL900_SR900,600_.jpg"
B095CLQ1PT,"TP-Link Tapo C210 - Cámara IP WiFi 360° Cámara de Vigilancia 2K (3MP),Visión nocturna Admite tarjeta SD hasta 256 GB, Detecci",29.90,4.6,17.120,"https://images-eu.ssl-images-amazon.com/images/I/71DmqGnVWoL._AC_UL900_SR900,600_.jpg"
B003UOWDCG,"Duracell - Pilas especiales alcalinas MN21 de 12 V, paquete de 2 unidades (A23 / 23A / V23GA / LRV08 / 8LR932) diseñadas para",3.79,4.6,98.619,"https://images-eu.ssl-images-amazon.com/images/I/71HKDHIWGrL._AC_UL900_SR900,600_.jpg"
B07MLDJF3B,Amazon Basics - Pilas alcalinas AAA de uso industrial (40 unidades),13.21,4.6,97.672,"https://images-eu.ssl-images-amazon.com/images/I/914KipL+JGL._AC_UL900_SR900,600_.jpg"
B08X6DCJT2,"Imou Cámara IP WiFi Interior 1080P con Detección de Humano, Cámara de Vigilancia WiFi Interior 360° con Sirena, Audio Bidirec",23.45,4.4,23.938,"https://images-eu.ssl-images-amazon.com/images/I/51ibns6pBhL._AC_UL900_SR900,600_.jpg"
B08CF5F64H,"Panasonic EVERYDAY POWER Pila alcalina AAA Micro LR03 1.5 V, Para una energía fiable, Paquete sin plástico con 20 unidades",6.99,4.5,2.037,"https://images-eu.ssl-images-amazon.com/images/I/81UFTKT5-lL._AC_UL900_SR900,600_.jpg"
B09QMB7V2T,"SPC Stella 2 - Teléfono móvil de Tapa para Mayores, Botones y Teclas Grandes, fácil de Usar, configuración remota, botón SOS,",30.99,4.2,1.017,"https://images-eu.ssl-images-amazon.com/images/I/619psHmg5rL._AC_UL900_SR900,600_.jpg"
B08746RF8T,"POWEROWL 40 Pilas de Botón Alcalinas AG13 LR44 de 1.5 V, A76/ V13GA / GP76A / 357 / SR44W Baterías de Botón",5.94,4.5,5.521,"https://images-eu.ssl-images-amazon.com/images/I/61cn1sqznaL._AC_UL900_SR900,600_.jpg"
B0B9HT47KZ,"Xiaomi POCO M5 - Smartphone de 4+128GB, Pantalla de 6.58"" 90Hz FHD+ DotDrop, MediaTek Helio G99, Triple cámara de 50MP con IA",119.99,4.1,374,"https://images-eu.ssl-images-amazon.com/images/I/614MGBwv9HL._AC_UL900_SR900,600_.jpg"
B005GGRN0S,"Panasonic KX-TG1611SPH - Teléfono Fijo Inalámbrico DECT, LCD, Identificador de Llamadas, Agenda de 50 Números, Tecla de Naveg",18.90,4.3,8.719,"https://images-eu.ssl-images-amazon.com/images/I/513vqSY1idL._AC_UL900_SR900,600_.jpg"
B00CWZQLZ4,"Famatel 9/704 Regleta ecosockets 4 Enchufes con Interruptor de Encendido | 1,5 Metros | hasta 250W | Protección Infantil | Or",7.71,4.7,974,"https://images-eu.ssl-images-amazon.com/images/I/51dAAybpO4S._AC_UL900_SR900,600_.jpg"
B000KTCEW8,"Duracell Pila especiales de botón de litio 2450 de 3 V, paquete de 1 unidad DL2450/CR2450, diseñada para uso en llaves con se",1.92,4.5,6.049,"https://images-eu.ssl-images-amazon.com/images/I/511X4gv2a3L._AC_UL900_SR900,600_.jpg"
B0CCXV8Q45,"Nerunsa Reloj Inteligente Hombre Mujer con Llamadas, 1,85"" Smartwatch 100+ Modos Deportivos, Pulsómetro, Monitor de Sueño, Pu",39.99,4.6,1.077,"https://images-eu.ssl-images-amazon.com/images/I/71zbWSRMaYL._AC_UL900_SR900,600_.jpg"
B0132XX152,Energizer Alkaline Power - Pack de 24 Pilas Alcalinas AAA/LR03,11.99,4.6,20.083,"https://images-eu.ssl-images-amazon.com/images/I/71EnxVbtCBL._AC_UL300_SR300,200_.jpg"
B003UP1OAM,"Duracell - Pilas de botón de litio 2025 de 3 V, paquete de 2, con Tecnología Baby Secure, para uso en llaves con sensor magné",1.84,4.6,21.657,"https://images-eu.ssl-images-amazon.com/images/I/71Ui3DWFKRL._AC_UL300_SR300,200_.jpg"
B09T6Y6JSG,"LENCENT Cubo Enchufe USB 7 en 1, Ladron Enchufes 4000W, Cubo Enchufes Múltiples Pared con 3 Tomas de CA, 3 USB, 1 Tipo C y In",23.99,4.6,743,"https://images-eu.ssl-images-amazon.com/images/I/51XRGxcSjPL._AC_UL300_SR300,200_.jpg"
B00CWNMXQW,"Amazon Basics - Pilas AAA recargables, precargadas, paquete de 8 (el aspecto puede variar)",11.39,4.5,296.375,"https://images-eu.ssl-images-amazon.com/images/I/71YwIVetTZL._AC_UL300_SR300,200_.jpg"
B0BZS77DBX,"Smartphone Xiaomi Redmi Note 12 Pro 8GB/ 256GB/ 6.67""/ Negro Medianoche",222.98,4.4,1.451,"https://images-eu.ssl-images-amazon.com/images/I/616XbpLCPxL._AC_UL300_SR300,200_.jpg"
B01K8BLXRO,"Gigaset A116 - Teléfono Inalámbrico, Agenda 50 Contactos, Negro",14.08,3.9,7.852,"https://images-eu.ssl-images-amazon.com/images/I/615A3JHC+0L._AC_UL300_SR300,200_.jpg"
B06VW5BH2K,"Duracell - Pilas de botón de litio 2032 de 3 V, paquete de 8, con Tecnología Baby Secure, para uso en llaves con sensor magné",11.99,4.6,17.668,"https://images-eu.ssl-images-amazon.com/images/I/71-T2HYV8lL._AC_UL300_SR300,200_.jpg"
B004KRGJFO,"Varta Pila Energy AAA Micro LR03 (paquete de 24 unidades), pila alcalina – ""Made in Germany"" – Adecuado para radios y relojes",6.99,4.6,6.259,"https://images-eu.ssl-images-amazon.com/images/I/716sKUvasWL._AC_UL300_SR300,200_.jpg"
B00LN803LE,"VARTA Pilas AA, paquete de 40, Industrial Pro, Baterías Alcalinas, 1,5V, paquete de almacenamiento de embalaje ecológico, Mad",15.34,4.6,78.820,"https://images-eu.ssl-images-amazon.com/images/I/71hzf2vbP5L._AC_UL300_SR300,200_.jpg"
B0BTFCP86M,Nuevo Amazon Fire TV Stick 4K Max | Dispositivo de streaming compatible con Wi-Fi 6E y fondo ambiental,79.99,3.7,30,"https://images-eu.ssl-images-amazon.com/images/I/41c8X0qCcyL._AC_UL300_SR300,200_.jpg"
B0C1NJR5W8,"Xiaomi TV Box S (2nd Gen) 4K Ultra HD Streaming Media Player, 2GB RAM + 8GB ROM con Mando a Distancia IR, Dolby Vision and HD",51.99,4.4,134,"https://images-eu.ssl-images-amazon.com/images/I/41zsX7WsOdL._AC_UL300_SR300,200_.jpg"
B0C8SW7L9Q,"YI Camara Vigilancia WiFi Interior Dome U 2K, Cámara de Seguridad IP 360°, Detección de Movimiento y Sonido, Visión Nocturna,",22.99,4.2,7.491,"https://images-eu.ssl-images-amazon.com/images/I/518LmVo7QVL._AC_UL300_SR300,200_.jpg"
B000EGQT78,"VARTA Pilas AAA, recargables, paquete de 4, Recharge Accu Power, batería recargable, 800 mAh Ni-MH, sin efecto memoria, preca",6.39,4.4,9.616,"https://images-eu.ssl-images-amazon.com/images/I/61IqLf9eBQL._AC_UL300_SR300,200_.jpg"
B0CL6FJ984,"Regleta Enchufe,4 Puertos de USB(3 USB A+1 USB C) y 6 Tomas Regleta Proteccion Sobretension Enchufe Alargador Multiple Carga ",70.00,4.3,1.627,"https://images-eu.ssl-images-amazon.com/images/I/616Y5VqfO7L._AC_UL300_SR300,200_.jpg"
B000YSQ7O6,"Maxell CR2032 3V - Pilas (Litio, Button/coin), paquete de 5 unidades",2.93,4.5,4.777,"https://images-eu.ssl-images-amazon.com/images/I/71B-TU9A96L._AC_UL300_SR300,200_.jpg"
B09B8X9RGM,"Echo Dot (5.ª generación, modelo de 2022) | Altavoz inteligente wifi y Bluetooth con Alexa, con sonido más potente y de mayor",64.99,4.6,11.244,"https://images-eu.ssl-images-amazon.com/images/I/71C3lbbeLsL._AC_UL300_SR300,200_.jpg"
B0130BP5QE,Aukru 3X Adaptador de Enchufe Europeo EU Europa ESPAÑA a EE.UU/Americano/US/China/Japón/Canadá/México Negro,5.99,4.5,1.228,"https://images-eu.ssl-images-amazon.com/images/I/41YGzjczZeL._AC_UL300_SR300,200_.jpg"
B0BW66P9XN,"Smartphone Xiaomi Redmi Note 12 Pro 8GB/ 256GB/ 6.67""/ 5G/ Negro Medianoche",265.03,4.4,1.491,"https://images-eu.ssl-images-amazon.com/images/I/61tevdEa2UL._AC_UL300_SR300,200_.jpg"
B0BYS8JXL9,"Smartwatch Hombre,1.85""Reloj Inteligente Hombre con Llamadas Bluetooth y Whatsapp Notificación-Impermeable IP68,Oxígeno Sangr",25.49,4.3,565,"https://images-eu.ssl-images-amazon.com/images/I/71oBa2nfD4L._AC_UL300_SR300,200_.jpg"
B000J656LS,"Duracell - Pilas especiales alcalinas de botón LR44 de 1,5 V, paquete de 2 unidades (76A/A76/V13GA) diseñadas para su uso en ",2.00,4.7,11.909,"https://images-eu.ssl-images-amazon.com/images/I/51AxMlNUa4L._AC_UL300_SR300,200_.jpg"
B00H59IYIY,"VARTA 10500403 Superlife - Batería de carbón de zinc AAA / R03 con 1,5 V, capacidad 800 mAh, 4 unidades",1.08,4.4,742,"https://images-eu.ssl-images-amazon.com/images/I/9188nZ2+ZXL._AC_UL900_SR900,600_.jpg"
B0B38J377R,"Xiaomi Redmi 10 (2022) - Smartphone 128GB, 4GB RAM, Dual Sim, Carbon Gray",0,4.2,1.170,"https://images-eu.ssl-images-amazon.com/images/I/51sdg+go6HL._AC_UL900_SR900,600_.jpg"
B0CC23PRMR,Xiaomi SMARTPHONE Xiaomi REDMI NOTE 12 8GB/256GB DUAL AZUL,182.00,4.2,75,"https://images-eu.ssl-images-amazon.com/images/I/61+8VF-k96L._AC_UL900_SR900,600_.jpg"
B00CWZQNWU,"Famatel IC-9/706 Regletas 6 Interruptor de Encendido | 1,5 Metros | hasta 3500W | Protección Infantil | Base enchufes Múltipl",8.98,4.6,619,"https://images-eu.ssl-images-amazon.com/images/I/71ikbZDRSpL._AC_UL900_SR900,600_.jpg"
B0C6D31QZ7,"Reloj Inteligente Hombre Mujer, 1,45"" Smartwatch Hombre con Alertas Whatsapp, 300 mAh Reloj Deportivo con Podómetro, Llamada ",59.99,4.3,137,"https://images-eu.ssl-images-amazon.com/images/I/71uifKm-4rL._AC_UL900_SR900,600_.jpg"
B07W4FMSD9,"EZVIZ Cámara Vigilancia WiFi Interior 360º, Camara Vigilancia Bebe 1080P, Visión Nocturna, Audio Bidireccional, Detección de ",27.99,4.4,23.090,"https://images-eu.ssl-images-amazon.com/images/I/61UsTJLR4HL._AC_UL900_SR900,600_.jpg"
B00MNV8E0C,"Amazon Basics Pilas alcalinas AA de 1,5 voltios, 48 Unidad, gama Performance (el aspecto puede variar)",15.07,4.5,1.369.803,"https://images-eu.ssl-images-amazon.com/images/I/81uBzbSP1+L._AC_UL900_SR900,600_.jpg"
B0C7R1RN2D,"Xiaomi Redmi Watch 3 Active - Llamadas Bluetooth, Pantalla LCD de 1,83”, Monitor de frecuencia cardíaca, 100 Modos Deportivos",0,4.4,744,"https://images-eu.ssl-images-amazon.com/images/I/51KcD3y1DeL._AC_UL900_SR900,600_.jpg"
B09SL7XNRX,"Mini Proyector Portátil - Soporta Full HD 1080P, Yoton Y3 Proyector Compatible con Móviles, Teléfonos, PC, PS5 y Xbox, Entrad",53.60,4.4,3.343,"https://images-eu.ssl-images-amazon.com/images/I/71XCW-0hsIL._AC_UL900_SR900,600_.jpg"
B0B84WN8ZR,"Glangeh Soporte Movil Bicicleta Universal, 360° Rotación Soporte Movil Moto para Manillar, Anti Vibración y Cierre Seguro Sop",10.99,4.4,1.079,"https://images-eu.ssl-images-amazon.com/images/I/81NsCGrVZZL._AC_UL900_SR900,600_.jpg"
B0C288W2SF,"Camara Espia 4K HD Mini WiFi Oculta Cámara Espía para Ver En El Movil, Interior/Exterior Mini Cámaras De Vigilancia inalambri",45.99,4.4,471,"https://images-eu.ssl-images-amazon.com/images/I/61+NOeDoryL._AC_UL900_SR900,600_.jpg"
B0C6XHP16M,"2 Piezas Enchufe Multiple, Triple y Doble, 250V/16A 4000W, Adaptador de Pared Portátil para Oficina, Viaje y Casa",9.98,4.1,71,"https://images-eu.ssl-images-amazon.com/images/I/51od3epvt-L._AC_UL900_SR900,600_.jpg"
B0BJCVBFVB,"TESSAN Ladron Enchufes Múltiple USB con 2 Puertos USB y USB C, Ladron Enchufes Plano de Pared para Oficina, Cocina, Compatibl",23.99,4.6,2.146,"https://images-eu.ssl-images-amazon.com/images/I/510yzRwRynL._AC_UL900_SR900,600_.jpg"
B0C6FGNLWN,"Umblue Reloj Inteligente Niños, Smartwatch Niña 3 4 5 6 7 8 9 10 11 12 años, Regalo Niña con 14 Juegos, Cámara Giratoria de 9",27.85,4.9,296,"https://images-eu.ssl-images-amazon.com/images/I/6106Wia9UxL._AC_UL900_SR900,600_.jpg"
B0BXDMWW2T,"Xiaomi Redmi Note 12- Smartphone 4GB RAM 128GB ROM AMOLED Pantalla 6,67'' FHD+ Snapdragon 685 Cámara Profesional 50MP 5000mAh",147.97,4.3,1.989,"https://images-eu.ssl-images-amazon.com/images/I/51lZz2SN01L._AC_UL900_SR900,600_.jpg"
B07NPNHTD4,"POWEROWL Cargador Rápido de Pilas Recargables, LCD para Ni-MH/Ni-CD AA/AAA, Ranura Independiente & USB Carga Rápida",10.99,4.4,277,"https://images-eu.ssl-images-amazon.com/images/I/61qGDAruRQL._AC_UL900_SR900,600_.jpg"
B09YFC8277,"Redmi 10 2022 – Smartphone de 4+128GB, Pantalla Dot Drop de 6,5” FHD+, MediaTek Helio G98, Cámara principal de 50 MP IA, Bate",129.99,4.3,126,"https://images-eu.ssl-images-amazon.com/images/I/51zRnUaAj3L._AC_UL900_SR900,600_.jpg"
B0CGJ8P6VC,"Popglory Reloj Inteligente Mujer, Llamadas/Presión Arterial/100+ Deportes Smartwatch Mujer, Frecuencia respiratoria Frecuenci",25.49,3.8,10.971,"https://images-eu.ssl-images-amazon.com/images/I/91HZ8PR9t3L._AC_UL900_SR900,600_.jpg"
B098FCM51S,"‎Corp. Panasonic CR2032 Pila botón de Litio 3V, 225mAh, Blister de 6",6.95,4.7,692,"https://images-eu.ssl-images-amazon.com/images/I/61eryKyDReS._AC_UL900_SR900,600_.jpg"
B018S4PTNW,"Pila de botón de litio de 3 V VARTA Electronics CR2032. paquete de 10 unidades, pilas de botón en un blíster original de 1 un",11.00,4.6,17.832,"https://images-eu.ssl-images-amazon.com/images/I/61x6JsaloJL._AC_UL900_SR900,600_.jpg"
B0132J3REG,Brennenstuhl Enchufe múltiple con 2 Tomas de Corriente y Interruptor (Enchufe Adaptador Doble por 2 Tomas de Corriente de Tie,4.19,4.6,792,"https://images-eu.ssl-images-amazon.com/images/I/51lKEWwuPxL._AC_UL900_SR900,600_.jpg"
B06XH9WXPY,"Retekess V115 Radio Portatil Pequeña, Transistores Radio FM Am SW, Digital Recargable Radio con MP3, SD TF, Grabación, Tiempo",19.99,4.2,3.387,"https://images-eu.ssl-images-amazon.com/images/I/71S-rz9uG1L._AC_UL900_SR900,600_.jpg"
B0BWFHP3CP,"Pilas AA alcalinas Paquete de 42 industriales LR6 1.5V [versión actualizada] para Juguetes, Reloj Despertador, Mando a Distan",10.89,4.5,1.070,"https://images-eu.ssl-images-amazon.com/images/I/81QDAQx0b1L._AC_UL900_SR900,600_.jpg"
B093LVB4P7,"Duracell Plus pilas AA (pack de 12) - Alcalinas 1,5 V - Hasta 100 % de extra duración - Fiabilidad para dispositivos cotidian",11.80,4.7,63.540,"https://images-eu.ssl-images-amazon.com/images/I/71AQuBiTuzL._AC_UL900_SR900,600_.jpg"
B000EGUKDW,"VARTA Pilas de 9V, paquete de 1, Longlife Power, Alcalina, para detectores de incendios, detectores de humo, micrófonos",3.41,4.5,13.947,"https://images-eu.ssl-images-amazon.com/images/I/51NhMrtkVNL._AC_UL900_SR900,600_.jpg"
B093LT2N4Q,"Duracell Plus pilas AAA (pack de 12) - Alcalinas 1,5 V - Hasta 100 % extra duración - Fiabilidad para dispositivos cotidianos",11.75,4.7,63.540,"https://images-eu.ssl-images-amazon.com/images/I/61BYXZGn7pL._AC_UL900_SR900,600_.jpg"
B004FBRRHE,"Unitec 445211 - Regleta (3 Tomas de Corriente, Interruptor, 1,4 m), Color Blanco",5.99,4.5,1.489,"https://images-eu.ssl-images-amazon.com/images/I/41kOkN73UhL._AC_UL900_SR900,600_.jpg"
B0748PZ6V1,"CEGASA CR1620 - Pack 2 Pilas botón Litio, Color Verde",2.95,4.5,365,"https://images-eu.ssl-images-amazon.com/images/I/61Vwq+yTGPL._AC_UL900_SR900,600_.jpg"
B07TWVH621,JSVER Cube Enchufe USB con 3 Puertos de USB y 3 Tomas Regleta Proteccion Sobretension Enchufe Alargador Multiple Carga para S,19.99,4.7,8.405,"https://images-eu.ssl-images-amazon.com/images/I/71T7-dSjQFL._AC_UL900_SR900,600_.jpg"
B07NWWLP5S,Amazon Basics - Pilas recargables AA (paquete de 12) de 2000 mAh precargadas,16.41,4.5,296.375,"https://images-eu.ssl-images-amazon.com/images/I/71QS6HSbuXL._AC_UL900_SR900,600_.jpg"
B000CSLIP6,"GP Batteries 23A - Pila alcalino de 12 V, (paquete de 5 unidades)",4.51,4.5,9.998,"https://images-eu.ssl-images-amazon.com/images/I/71yFTI4WnEL._AC_UL300_SR300,200_.jpg"
B07WPCF7RY,"Autoradio Bluetooth, CENXINY FM 4x65W Radio para Coche Bluetooth 5.0 Llamadas Manos Libres Control Remoto Radio stéreo de Coc",23.98,3.8,2.906,"https://images-eu.ssl-images-amazon.com/images/I/61NLunb9fVL._AC_UL300_SR300,200_.jpg"
B0BVZ65S6Y,"Smartphone Xiaomi Redmi 12C 4GB/ 128GB/ 6.71""/ Gris Grafito",116.99,4.3,1.840,"https://images-eu.ssl-images-amazon.com/images/I/418UnMPPn9L._AC_UL300_SR300,200_.jpg"
B084KPFP78,"LIORQUE Radio Despertador Proyector, Reloj Despertador Digital con Gran VA Pantalla, Radio Reloj FM, C°/F°, 12/24 H, DST, 4 N",27.99,4.3,1.272,"https://images-eu.ssl-images-amazon.com/images/I/61Euywu9V-L._AC_UL300_SR300,200_.jpg"
B00CWNMV4G,"Amazon Basics - Pilas AA recargables, precargadas, paquete de 8 (el aspecto puede variar)",13.12,4.5,296.375,"https://images-eu.ssl-images-amazon.com/images/I/71xQ8dViZsL._AC_UL300_SR300,200_.jpg"
B0BSLJNW5G,"Motorola Smartphone g73 5G, 8/256GB, Camara 50MP,Batería 5000mAh,Azul",0,4.3,119,"https://images-eu.ssl-images-amazon.com/images/I/81CMdgkIULL._AC_UL300_SR300,200_.jpg"
B0B2DTQ41Y,"TESSAN Adaptador Enchufe Universal, Viaje con 2 USB y 3 USB C, Adaptador de Viaje para USA, UK, Irland, Austuralia, Cargador ",19.99,4.7,5.462,"https://images-eu.ssl-images-amazon.com/images/I/51HsRTXWuRL._AC_UL300_SR300,200_.jpg"
B08CF4Q1NL,"Panasonic EVERYDAY POWER Pila alcalina AA Mignon LR6 1.5 V, Para una energía fiable, Paquete sin plástico con 20 unidades",8.99,4.5,2.424,"https://images-eu.ssl-images-amazon.com/images/I/61BcfxB2OiL._AC_UL300_SR300,200_.jpg"
B08CZRY8HZ,"KSIX Aro de Luz Trípode 1,60M Regulable. Anillo de Luz Led para Móvil, 3 Temperaturas de Luz y 10 Intensidades de Brillo. Rin",22.42,4.2,312,"https://images-eu.ssl-images-amazon.com/images/I/51WADbX0N1L._AC_UL300_SR300,200_.jpg"
B0C7QCSXQH,"Beidongli Pilas de botón LR1130 AG10 1131 189 1,5 V batería alcalina 20 unidades LR54 pila de botón 【3 años de garantía de al",4.99,4.5,44,"https://images-eu.ssl-images-amazon.com/images/I/61sMN2oQp7L._AC_UL300_SR300,200_.jpg"
B000MQHXVQ,BATERIE GP 23A/A23/MN21 Alkaline 12V,1.15,4.5,2.218,"https://images-eu.ssl-images-amazon.com/images/I/71o8Ik+ULuL._AC_UL300_SR300,200_.jpg"
B07L49RDJH,"Energizer Pilas AA, pilas alcalinas de potencia doble A, 24 Unidades (Paquete de 1)",15.49,4.7,62.606,"https://images-eu.ssl-images-amazon.com/images/I/71-6T-ANOcL._AC_UL300_SR300,200_.jpg"
B08FMCQ6MH,"Torre Regletas Enchufes con Cable 3M, Regleta USB 8 Tomas de AC Corrientes y 4 USB, 2500W/10A, Regreltas Vertical con Interru",29.99,4.6,5.612,"https://images-eu.ssl-images-amazon.com/images/I/71oGFDM4fLL._AC_UL300_SR300,200_.jpg"
B000VDGVYK,Duracell Specialty MN21 Long lasting - Blister de 5 pilas alcalinas,8.01,4.6,1.789,"https://images-eu.ssl-images-amazon.com/images/I/61G6kJ1wB5L._AC_UL300_SR300,200_.jpg"
B0BL1PYL4Z,"Xiaomi Smart Camera C200 - Cámara de vigilancia con resolución 1080p, 360°, apertura F2.1, visión nocturna, detección de movi",29.99,4.4,369,"https://images-eu.ssl-images-amazon.com/images/I/41pmzUIlXyL._AC_UL300_SR300,200_.jpg"
B07K5ZZ92J,"Pack de 12 Pilas AG13 1,5V Tipo Botón de Litio, LR44, A76, GP76A, 357, SR44W, SR44SW",2.50,4.4,2.737,"https://images-eu.ssl-images-amazon.com/images/I/61S392NgJaL._AC_UL300_SR300,200_.jpg"
B09B94956P,"Echo Dot (5.ª generación, modelo de 2022) | Altavoz inteligente wifi y Bluetooth con Alexa, con sonido más potente y de mayor",64.99,4.6,11.244,"https://images-eu.ssl-images-amazon.com/images/I/71YVBa7zc5L._AC_UL300_SR300,200_.jpg"
B0C1SPV1DW,"Regletas Enchufes Proteccion Sobretension Pared con USB C(PD 20W), Ladron Enchufes con Interruptor, Regleta 4 Enchufes Conmut",29.99,4.7,217,"https://images-eu.ssl-images-amazon.com/images/I/51MEeayFt5L._AC_UL300_SR300,200_.jpg"
B00011PJDQ,"Duracell - Pilas especiales de litio CR2 High Power de 6 V, paquete de 2 unidades ( CR15H270 ) diseñadas para su uso en senso",6.99,4.6,98.619,"https://images-eu.ssl-images-amazon.com/images/I/71m-t+zS3XL._AC_UL300_SR300,200_.jpg"
B0BSLKFY68,"Motorola Smartphone e13, 2/64GB, Camara 13MP, Batería 5000mAh,Negro",77.50,4.3,55,"https://images-eu.ssl-images-amazon.com/images/I/71ZV2+4XNVL._AC_UL300_SR300,200_.jpg"
