rank,asin,title,price,rating,num_reviews,img_link
1,B08CRV3XXV,"NOKLEAD Termómetro interior del higrómetro, termómetro digital de escritorio con monitor de temperatura y humedad, termómetro de (Blanco)",0,4.5,1299,"https://images-eu.ssl-images-amazon.com/images/I/61qgX3ZJKuL._AC_UL600_SR600,400_.jpg"
2,B00U8SA6NA,"S&M 321771 Kit completo Regulador de gas butano+ Tubo Goma 1,5 metros + 2 abrazaderas de seguridad, Gris/Naranja",0,4.5,1585,"https://images-eu.ssl-images-amazon.com/images/I/71B8+HDfwrL._AC_UL600_SR600,400_.jpg"
3,B07TV364MZ,"ThermoPro TP49 Pequeño higrómetro digital, termómetro de interior para controlar la temperatura y medir la humedad, para la comodidad en la oficina y en casa, termómetro para reptil",0,4.5,899,"https://images-eu.ssl-images-amazon.com/images/I/61xkwCA-gfL._AC_UL600_SR600,400_.jpg"
4,B00L988P1I,"Relec Extra Fuerte Spray Antimosquitos, Repelente de Mosquitos, Eficaz Contra El Mosquito Tigre, Eficacia y Protección Contra las Picaduras de Mosquitos en Condiciones Extremas y Zonas Tropicales",0,4.6,902,"https://images-eu.ssl-images-amazon.com/images/I/81U2WPzsUDL._AC_UL600_SR600,400_.jpg"
5,B09QPNR8L9,"The Pink Stuff Pasta Limpiadora Milagrosa Ideal para limpiar todo tipo de superficies, 850g",0,4.3,1245,"https://images-eu.ssl-images-amazon.com/images/I/71u+xlCJtTL._AC_UL600_SR600,400_.jpg"
6,B078GX338Q,"Tamar Invernador Liquido para Piscinas, Invernaje y conservación, alguicida, 5 litros",0,4.3,1925,"https://images-eu.ssl-images-amazon.com/images/I/71o1D4Bd7XL._AC_UL600_SR600,400_.jpg"
7,B0BHSLYX42,"Mini Termómetro Higrómetro Digital Medidor de Temperatura y Humedad, Termohigrómetro de Interior - 3 piezas",0,4.3,1099,"https://images-eu.ssl-images-amazon.com/images/I/51+-2ScN8OL._AC_UL600_SR600,400_.jpg"
8,B08F54GM1H,"AWNIC Funda para Mesa Exterior Impermeable, Funda Protectora Muebles de Jardín, Funda para Sofa de Jardín, AlicanTex Tecnología Resistente a la Intemperie 245x160x71cm",0,4.5,4099,"https://images-eu.ssl-images-amazon.com/images/I/51RciPtQeqL._AC_UL600_SR600,400_.jpg"
9,B07DCVKCMX,"Ecogel Cucarachas Jeringa, Insectos, 10 Gramos, Transparente, Talla Única",0,4.5,1260,"https://images-eu.ssl-images-amazon.com/images/I/41GFOUsj8vL._AC_UL600_SR600,400_.jpg"
10,B09J4PSWV5,"Biotop - Paño de Tela Térmica Protectora Antiheladas para Todo Tipo de Plantas y Arbustos, 2 Metros de Ancho por 10 Metros de Largo, Tejido Suave y Resistente de 30 g/m2",0,4.4,1120,"https://images-eu.ssl-images-amazon.com/images/I/31O8HpxBrDL._AC_UL600_SR600,400_.jpg"
11,B09JGS8XQ5,"Allergoff Antiacaros Spray 400ml | Spray para Colchon, Cama y Textiles | Producto Anti Acaros | Para alérgicos | Contra Alergia Gatos y Perros | Eliminar los síntomas de alergia",0,4.2,2299,"https://images-eu.ssl-images-amazon.com/images/I/71cfNn8SsWL._AC_UL600_SR600,400_.jpg"
12,B01C7JN422,"Semillas Batlle - Sustrato Universal 5l, color Amarillo",0,4.4,699,"https://images-eu.ssl-images-amazon.com/images/I/81tS9O8K51L._AC_UL600_SR600,400_.jpg"
13,B08D246QL2,Catchmaster 100i – Trampas Cucarachas – 30 Piezas – Trampas Adhesivas de máxima Calidad para Cucarachas – Sin Veneno ni biocidas – Trampa Anti Cucarachas – Seguro para Niños y Mascotas,0,4.2,1799,"https://images-eu.ssl-images-amazon.com/images/I/81rXUFaAoVL._AC_UL600_SR600,400_.jpg"
14,B07MM2FTVD,PIC Trampa para Polilla de despensa 6X Piezas - Medios de protección contra Las polillas en la Cocina y el Almacenamiento de Alimentos,0,4.4,999,"https://images-eu.ssl-images-amazon.com/images/I/81BGjVaRQSL._AC_UL600_SR600,400_.jpg"
15,B07H7ZXVCN,"Orbegozo LO 7000 Brasero Eléctrico, Óptimo para Mesa Camilla, 3 Posiciones de Funcionamiento, Rejilla de Seguridad, Gancho Incorporado, 400 W",0,4.5,1699,"https://images-eu.ssl-images-amazon.com/images/I/616y+5DYdUL._AC_UL600_SR600,400_.jpg"
16,B09QLT4K4R,"XIAZIR Mini Motosierra Bateria Portátil de Mano 6 Pulgadas, 21 V Motosierra Eléctrica con cargador, batería, llave, adecuado para el jardín (Naranja 6 pulgadas)",0,4.1,4998,"https://images-eu.ssl-images-amazon.com/images/I/71K37pXcr3L._AC_UL600_SR600,400_.jpg"
17,B0128FZEP0,"Flower 80070 - Coco flower, 9 l, No Aplica, 10.5 x 21 x 5.5 cm",0,4.5,315,"https://images-eu.ssl-images-amazon.com/images/I/91Au7OtAjBL._AC_UL600_SR600,400_.jpg"
18,B01IDLX6BM,"COMPO Fertilizante de plantas verdes para plantas de interior, balcón y terraza, Fertilizante líquido con extra de potasio y hierro, 1,3 L",0,4.6,760,"https://images-eu.ssl-images-amazon.com/images/I/71T6dfDE5VL._AC_UL600_SR600,400_.jpg"
19,B0CLDB55HT,"THINIA HOME Mesa Catering Plegable Portátil Rectangular 180 cm Mesa Multiusos: Camping, Eventos en Espacios Exteriores o Interiores | Mesa Resina y Patas Acero | 4-6 Personas y Carga de 150kg",0,0.0,0,"https://images-eu.ssl-images-amazon.com/images/I/51plFBqAGBL._AC_UL600_SR600,400_.jpg"
20,B07R85FWGP,"Hama Estación meteorológica interior y exterior con Reloj digital, Con función reloj y fecha, medición temperatura y humedad y con pronóstico del tiempo, Color Blanco",0,4.0,1499,"https://images-eu.ssl-images-amazon.com/images/I/51yorjRX0EL._AC_UL600_SR600,400_.jpg"
21,B0C7GXFGLZ,"SINPY Mini Motosierra Bateria - 6000 mAh Motosierra Bateria de 6 Pulgadas, con Bloqueo de Seguridad, Cadena de Acero al Manganeso de Mano y Engrasador Automático, Mini Sierra Electrica Bateria",0,4.5,6399,"https://images-eu.ssl-images-amazon.com/images/I/819HFsJ3F9L._AC_UL600_SR600,400_.jpg"
22,B06XJ7W4Q2,"Biotop, Búho Espantapájaros, Gira la Cabeza con el Viento, No necesita Pilas, Marrón",0,3.5,1445,"https://images-eu.ssl-images-amazon.com/images/I/71EiN7zBgLL._AC_UL600_SR600,400_.jpg"
23,B082VTLJLC,"Raid ® Cebos - Trampa antihormigas, elimina la colonia de hormigas entera, efectivo en Interiores y Exteriores, 1 Unidad (Paquete de 1)",0,3.9,498,"https://images-eu.ssl-images-amazon.com/images/I/61WVnl5-2hL._AC_UL600_SR600,400_.jpg"
24,B0B7KB8WKX,"Runesol Bandera De España 3x5, 91x152cm, Bandera De España, 4 Ojales, Ojal De Latón En Cada Esquina, Celebraciones De La Eurocopa, Copa Del Mundo De Fútbol, Banderas Premium, Interior, Exterior",0,4.5,749,"https://images-eu.ssl-images-amazon.com/images/I/71JIONrqY8L._AC_UL600_SR600,400_.jpg"
25,B0798DVXTX,"Keter, Comfy, Arcón exterior, Baúl almacenaje y ordenación jardín y terraza, Resina, Color marrón, Capacidad 270 litros, 44,7 x 116,7 x 57 cm, 6,3 Kg",0,4.3,4969,"https://images-eu.ssl-images-amazon.com/images/I/81Umt93aDfL._AC_UL600_SR600,400_.jpg"
26,B08C55XH7P,"Hywean 40 Piezas de Papel Fly Catcher, Juego de Moscas de Frutas pegajosas para Interiores y Exteriores, Control de Moscas, Mosquitos y Otros Insectos voladores",0,4.0,1099,"https://images-eu.ssl-images-amazon.com/images/I/812NuHSgMtL._AC_UL600_SR600,400_.jpg"
27,B07NZXJK95,"COMPO Bio Insecticida Stop, Insecticida para hortícolas y plantas aromáticas, Apto para agricultura ecológica, Control de plagas en hortalizas y plantas aromáticas, 750 ml",0,4.0,899,"https://images-eu.ssl-images-amazon.com/images/I/41y7PG7JkML._AC_UL600_SR600,400_.jpg"
28,B0128FYMIA,"Flower Substrato Orquídeas 5 L, Marrón, 24 x 4.5 x 39 cm",0,4.4,335,"https://images-eu.ssl-images-amazon.com/images/I/71OKraW1rJL._AC_UL600_SR600,400_.jpg"
29,B07RGNZ3BQ,"Baygon Trampas - Cebo para Cucarachas, 3 Meses de Protección, Máxima Eficacia, Contiene 6 Cebos, Blanco, Estandar, Pastilla",0,3.9,584,"https://images-eu.ssl-images-amazon.com/images/I/81AVsQGRJUL._AC_UL600_SR600,400_.jpg"
30,B08DD93FSF,"RepellShield Spray Repelente Chinches para Piel, Cama, Ropa, Sábanas, 250ml - Spray Anti Chinches de Cama Eliminar - Alternativa Ecológica al Insecticida Chinches Cama y Liquido Mata Chinches de Cama",0,3.9,1599,"https://images-eu.ssl-images-amazon.com/images/I/61pee3wrLMS._AC_UL600_SR600,400_.jpg"
31,B0BMQ386LN,"Ainiv Higrometro Digital Termometro, 1 Piezas Mini Termómetro Interior del Higrómetro, Pantalla LED con Logo de Confort para Termometro Ambiental para Hogar Oficina Dormitorio Jardín (Blanco)",0,4.0,499,"https://images-eu.ssl-images-amazon.com/images/I/618sHHJKZjL._AC_UL300_SR300,200_.jpg"
32,B0BCP7LWHF,"AOSTOK Mini Motosierra Eléctrica 6 Pulgadas, con 2 baterías, 2 Cadenas, Motosierra de una mano, Inalámbrica para Ramas, arboles, Patio, Hogar, Jardin",0,4.1,4583,"https://images-eu.ssl-images-amazon.com/images/I/71QwjFW5GhL._AC_UL300_SR300,200_.jpg"
33,B00Q54PNQ6,FUEGO NET Fuegonet 231281N Pastillas Ecológicas,0,4.3,1435,"https://images-eu.ssl-images-amazon.com/images/I/81ZZgsiXd5S._AC_UL300_SR300,200_.jpg"
34,B07X451W3F,AWNIC 420D Poliéster Funda para Sillas Apilables Funda Sillas Apiladas Jardín Impermeable Resistente 65X75X120cm,0,4.7,1954,"https://images-eu.ssl-images-amazon.com/images/I/51AV5AOXDCL._AC_UL300_SR300,200_.jpg"
35,B08FD89RPD,"Govee Termómetro Higrómetro, LCD Bluetooth Medidor Digital Humedad y Temperatura Interior con Función Almacenamiento de Datos y Alerta, para Habitación",0,4.5,1699,"https://images-eu.ssl-images-amazon.com/images/I/61eG2qfkPvL._AC_UL300_SR300,200_.jpg"
36,B07CZ1KVG7,"Ratibrom 2 - Cebo Fresco Raticida, 150 gr",0,3.9,760,"https://images-eu.ssl-images-amazon.com/images/I/6146m2RkxOL._AC_UL300_SR300,200_.jpg"
37,B09CGDXH5W,Pack 2 UDS - DOSIFICADOR INVERNADA AQUAPOOL 4 KG (2x2 KG) - Compacto 5 Acciones - Sin Cobre - Tratamiento autodosificador Piscinas Invierno - Apto Piscinas Liner,0,4.1,3145,"https://images-eu.ssl-images-amazon.com/images/I/71XFNRUgZLL._AC_UL300_SR300,200_.jpg"
38,B0BM5L4DKK,"Mini Motosierra Bateria 8000mAh, Seesii 6'' Motosierra Eléctrica Bateria con Depósito Para El Aceite y 2 baterías, Motosierra Inalámbrica Portátil para Podar Árboles de Jardinería, CH600+",0,4.4,8500,"https://images-eu.ssl-images-amazon.com/images/I/81a305aMaUL._AC_UL300_SR300,200_.jpg"
39,B00EXUYOAA,super-ego SEH003800 - Cartucho de gas para camping 250,0,4.6,260,"https://images-eu.ssl-images-amazon.com/images/I/51Cqoga-u9S._AC_UL300_SR300,200_.jpg"
40,B00YC0PCB6,Herbicida Roundup UltraPlus 500ml,0,4.3,930,"https://images-eu.ssl-images-amazon.com/images/I/61M-ikIe6kL._AC_UL300_SR300,200_.jpg"
41,B00WI5LFNQ,Semillas Batlle Sustrato Cactus 5l.,0,4.6,210,"https://images-eu.ssl-images-amazon.com/images/I/61ufpr4kAYL._AC_UL300_SR300,200_.jpg"
42,B07TLNKFKP,"Mutsitaz Funda para Muebles de Jardín Impermeable Oxford Muebles de Jardin Cubierta, Tamaño (170x 94x 70 cm)",0,3.9,1697,"https://images-eu.ssl-images-amazon.com/images/I/71fzT+XNTSL._AC_UL300_SR300,200_.jpg"
43,B00H8OK7XG,"Corpol 5000026 Mata Carcomas, 500Ml",0,4.3,1134,"https://images-eu.ssl-images-amazon.com/images/I/41wMrszQGTL._AC_UL300_SR300,200_.jpg"
44,B07ZTDCHD3,Todo Cultivo herbicida Roundup ultraplus glifosato 36% 1 litro. Pack 2 uds de 500 ml. (60 litros de Agua). Herbicida liquido Concentrado sin Efecto Residual.,0,4.4,2230,"https://images-eu.ssl-images-amazon.com/images/I/41zJ2cS1IUL._AC_UL300_SR300,200_.jpg"
45,B0CHFY1HBK,"JUPPLIES Estufa de Gas Butano Plegable - Potencia 4200 W, Estufa Cerámica, 3 niveles de potencia, Triple Sistema de Seguridad, Sistema anti-vuelco, Bombonas hasta 15 kg, 20-80m²",0,4.7,9499,"https://images-eu.ssl-images-amazon.com/images/I/619EmHNs28L._AC_UL300_SR300,200_.jpg"
46,B07BZ1NZF8,"Xpansy C2607A Basic - Manguera extensible para agua a presión, color verde, 7.5 metros",0,3.3,1423,"https://images-eu.ssl-images-amazon.com/images/I/71o3QucpodL._AC_UL300_SR300,200_.jpg"
47,B09C6FYVYT,DOSIFICADOR INVERNADA AQUAPOOL 2 KG - Compacto 5 Acciones - Sin Cobre - Desinfectante y Algicida para el Tratamiento de Piscinas en Invierno con AUTODOSIFICADOR - Apto Piscinas Liner,0,4.0,1675,"https://images-eu.ssl-images-amazon.com/images/I/61udPEfBN2L._AC_UL300_SR300,200_.jpg"
48,B0B1DJ7LMB,"DOOMAY 2Pcs mini higrómetro termómetro interior, medidor de humedad con Celsius (℃), medidor de humedad digital de temperatura para humidores, invernadero, bebé, bodega, reptil, incubadora, armario",0,4.4,999,"https://images-eu.ssl-images-amazon.com/images/I/51geX9vHTyL._AC_UL300_SR300,200_.jpg"
49,B0C2V4361L,"RISVOWO Funda para Barbacoa, Cubierta BBQ de Parrilla, 210D Oxford Funda Barbacoa Exterior Impermeable para Exterior Prueba de Lluvia/Viento/UV(147x61x117cm)",0,4.3,1199,"https://images-eu.ssl-images-amazon.com/images/I/61Go6eq-qJL._AC_UL300_SR300,200_.jpg"
50,B08G1Q1PG5,LIORQUE Termómetro Higrometro Digital para Interior Medidor de Temperatura y Humedad con Registro Máximo y Mínimo para Hogar y Oficina (Batería Incluida),0,4.5,1199,"https://images-eu.ssl-images-amazon.com/images/I/61Z1cYhupXL._AC_UL300_SR300,200_.jpg"
51,B0746NRR5H,"Crickwoo - Humus de Lombriz para Plantas Puro. El Mejor Abono Natural, 3L / 1,2KG, Fertilizante Universal Orgánico, Rico en microorganismos efectivos para Cualquier Tipo de Cultivo",0,4.5,832,"https://images-eu.ssl-images-amazon.com/images/I/61-Q+7WfBZL._AC_UL600_SR600,400_.jpg"
52,B08YYZ7L8V,"Kingnetstore Rellenos Cojines Sofa hipoalergénicas para Funda Cojines Decoracion y para Almohadas de Cama (45x45cm, 4)",0,4.5,1439,"https://images-eu.ssl-images-amazon.com/images/I/41DpvhFcUgL._AC_UL600_SR600,400_.jpg"
53,B0BMG2LBLT,"LEVIPE Estación Meteorológica Inalámbrica, Termómetro Higrómetro Barómetro Interior Exterior con Sensor LED Retroiluminación Pantalla Reloj Digital Alarma y Snooze Pantalla Hora Fecha Día Negro",0,4.4,2999,"https://images-eu.ssl-images-amazon.com/images/I/619GORmOFOL._AC_UL600_SR600,400_.jpg"
54,B099S6TNTZ,"Einhell Aspirador eléctrico de hojas, aspiración/soplado, tubo de aspiración Ø 75 mm, capacidad 650 m³/h, función de trituración, relación 10:1, soplado 240 km/h, bolsa colectora de 40 l",0,4.0,4299,"https://images-eu.ssl-images-amazon.com/images/I/61iAo7sDjfL._AC_UL600_SR600,400_.jpg"
55,B01G9828SS,"Tamar Cloro 5 Acciones,Tabletas Multifuncion 200 grs,biocida multiacción,Pastillas de disolución Lenta, Mantenimiento Agua Piscina,desinfectante,clarificante,alguicida,regulador pH y antical 5 Kilos",0,4.2,2995,"https://images-eu.ssl-images-amazon.com/images/I/41N3JMfWVBL._AC_UL600_SR600,400_.jpg"
56,B09K7NSGKX,"CEEPUY Motosierra a Bateria, 6000mAh Mini Motosierra 6 Pulgadas 800W Eléctrica Portátil con Engrasador Automáticopara y 2 Baterías",0,4.2,7999,"https://images-eu.ssl-images-amazon.com/images/I/71QNYjaXwTL._AC_UL600_SR600,400_.jpg"
57,B079JXY1RC,ThermoPro TP53 Termómetro Higrómetro Digital Medidor de Humedad y Temperatura de Interior Termohigrómetro Profesional para Habitación Ambiente con Retroiluminación Táctil,0,4.5,1199,"https://images-eu.ssl-images-amazon.com/images/I/71MJ7yc7w8L._AC_UL600_SR600,400_.jpg"
58,B09BDF1KRD,NOVAR ECOGEL Cockroach Syringe | Professional Effectiveness | Eliminate 50 Cockroaches with a Single Drop | 10 g Ecopack (ECOGEL Syringe Against Cockroaches Blister),0,4.5,899,"https://images-eu.ssl-images-amazon.com/images/I/71W6d2BlJsL._AC_UL600_SR600,400_.jpg"
59,B072XSJFHL,GARDIGO® 3 Trampas para Ratones Vivos I Atrapa Ratones sin Dañarlos I Rápida y Fácil de Usar para Interior y Exterior I Ratonera Reutilizable sin Veneno,0,4.2,1599,"https://images-eu.ssl-images-amazon.com/images/I/81EuA1H67oL._AC_UL600_SR600,400_.jpg"
60,B085J1132L,AKTIVE 61500 - Funda protectora Resistente al desgaste mesa de jardin 180x110x60 cm AKTIVE garden,0,4.2,1895,"https://images-eu.ssl-images-amazon.com/images/I/71A39c1s+NL._AC_UL600_SR600,400_.jpg"
61,B01LZPDDC5,"Flower Substrato Univ.Premium 4-80007 10 L, Marrón, 29 x 6 x 46 cm",0,4.4,874,"https://images-eu.ssl-images-amazon.com/images/I/91Xuhxko7LL._AC_UL600_SR600,400_.jpg"
62,B0798KDLZZ,"Tamar Invernador Poliester/Liner Electrólisis Salina Piscinas, Invernaje y conservación, sin Sulfato de Cobre, alguicida, 5 litros.",0,4.3,1925,"https://images-eu.ssl-images-amazon.com/images/I/81mepIHxSqL._AC_UL600_SR600,400_.jpg"
63,B089VKVYGC,ALLPOWERS Estación de energía portátil 288Wh 78000mAh 300W Generador Solar Portátil Exterior Batería de Litio de Respaldo de Emergencia para Acampar al Aire Libre Laptop smartphone,0,4.1,16999,"https://images-eu.ssl-images-amazon.com/images/I/71KG66Ol6vL._AC_UL600_SR600,400_.jpg"
64,B0128FYSQG,"Flower Substrato Cactus 5l, Marrón, 23 x 4 x 40 cm",0,4.5,335,"https://images-eu.ssl-images-amazon.com/images/I/91u47GImGaL._AC_UL600_SR600,400_.jpg"
65,B0BYVK54TT,"JYGMPRO Mini Motosierra Bateria 8 Pulgadas, Motosierra Inalámbrica con Motor sin Escobillas e Incluye 2 Baterías 2.0Ah, 2 Cadenas, 10m/s Velocidad Cadena, Para Cortar Ramas Y Madera En El Jardín",0,4.5,8076,"https://images-eu.ssl-images-amazon.com/images/I/71fHD95OWML._AC_UL600_SR600,400_.jpg"
66,B09XTRKNB2,VANSHEIM Funda Muebles Jardín Impermeable Funda Mesa y Sillas Exterior Jardin Cubierta para Sillones Baja Taburete Mesita Tumbonas Fundas Oxford 420D Impermeable Tela Cuadrado Negro 90x90x90cm,0,4.7,2399,"https://images-eu.ssl-images-amazon.com/images/I/41KrbrlxbPL._AC_UL600_SR600,400_.jpg"
67,B015KRKZJ8,"COMPO Fertilizante de calidad para plantas ornamentales de interior o terraza, Fertilizante líquido universal con extra de magnesio, 500 ml",0,4.5,499,"https://images-eu.ssl-images-amazon.com/images/I/71T9h9S4n2L._AC_UL600_SR600,400_.jpg"
68,B09X5PYJ5P,"D.RECT 50m Yute Natural Marrón Envolver Regalos | Cuerda Decorativa | 2mm de Grosor | para: Embalaje, Bricolaje, Floristería, Decoración, Jute Yarn, 50 m",0,4.6,399,"https://images-eu.ssl-images-amazon.com/images/I/61qgwppioSL._AC_UL600_SR600,400_.jpg"
69,B0963J155G,Super Ninja Trampa ecológica para Moscas de la Fruta - Pack de 2 atrapamoscas - Alta eficacia para Cocina e Interior - hasta 3 semanas,0,3.8,999,"https://images-eu.ssl-images-amazon.com/images/I/81Mp7ofFwAL._AC_UL600_SR600,400_.jpg"
70,B005AEDOX6,"Tukan - Pulverizador a presión de 1,5 litros, para jardín, para la protección de plantas, boquilla ajustable",0,4.2,920,"https://images-eu.ssl-images-amazon.com/images/I/41CSW5W-KPL._AC_UL600_SR600,400_.jpg"
71,B0055ZT16E,"Jata BQ101 Electro Barbacoa Sin Humos Ni Olores Parrilla con 2 Alturas para Cocinar Sano en el interior con Todas las Comodidades 2400 W, Color Negro",0,4.2,3699,"https://images-eu.ssl-images-amazon.com/images/I/81xC8aSjqaL._AC_UL600_SR600,400_.jpg"
72,B00HIXQQ32,"CHEMINETT 15751-32 Cubos Encendido precortados Cheminett naturales para encender chimeneas, estufas y barbacoas",0,4.1,199,"https://images-eu.ssl-images-amazon.com/images/I/61UybogM3dL._AC_UL600_SR600,400_.jpg"
73,B08V12CT4C,ThermoPro TP49-2 pequeño higrómetro digital termómetro interior termómetro ambiente monitor de temperatura y medidor de humedad para la comodidad de la oficina en casa termómetro reptil 2 piezas,0,4.5,1499,"https://images-eu.ssl-images-amazon.com/images/I/61+XG6ufWjL._AC_UL600_SR600,400_.jpg"
74,B00XAEQARU,Fogo AntiMosquitos Recambios para insecticida eléctrico mata mosquitos - 60 pastillas (238818),0,4.7,829,"https://images-eu.ssl-images-amazon.com/images/I/71TLqwvC6JL._AC_UL600_SR600,400_.jpg"
75,B01H1R0K68,ThermoPro TP50 Termómetro Higrometro Digital para Interior Termohigrómetro Medidor Profesional para Medición de Temperatura y Humedad del Casa Ambiente,0,4.4,11199,"https://images-eu.ssl-images-amazon.com/images/I/61sk3L14n9L._AC_UL600_SR600,400_.jpg"
76,B00NU0Z7IC,"Massó Fuegonet, Pastillas de encendido ecológicas para barbacoas y chimeneas, 1 paquete de 32 pastillas",0,4.3,459,"https://images-eu.ssl-images-amazon.com/images/I/A1eRwWyE5CL._AC_UL600_SR600,400_.jpg"
77,B09LXYGP9B,"Dokon Fundas para Muebles de Jardín, Resistente 600D Oxford, Impermeable, Anti-Viento, Anti-UV Cubierta Mesa Exterior, Funda Protectora Muebles con Salidas de Aire, Rectangular (180x120x74cm) - Negro",0,4.5,2599,"https://images-eu.ssl-images-amazon.com/images/I/61k3t3oSTgL._AC_UL600_SR600,400_.jpg"
78,B08F55FRD6,"AWNIC Funda Tumbona Exterior Impermeable, Fundas Para Tumbonas con Salidas de Aire Impermeable Patio UV Resistente 420D Poliéster 200x75x40/70cm",0,4.5,2078,"https://images-eu.ssl-images-amazon.com/images/I/51S02haxoCL._AC_UL600_SR600,400_.jpg"
79,B09C8J31PH,INVERNADOR LÍQUIDO SIN Cobre 5 litros - Desinfectante y Algicida para el Tratamiento de Piscinas en Invierno - Apto Piscinas Liner,0,4.2,1645,"https://images-eu.ssl-images-amazon.com/images/I/51OY12F9rdL._AC_UL600_SR600,400_.jpg"
80,B07S2XGN1X,"LETAL Gel Insecticida Hormigas - Cebo Mata Hormigas para Uso Doméstico de Zotal, Pack de 20 g en Total - Elimina Colonias de Hormigas que se Alimentan de Azúcares, Evitando su Proliferación",0,4.1,1365,"https://images-eu.ssl-images-amazon.com/images/I/81jhQY06j4L._AC_UL600_SR600,400_.jpg"
81,B01C7JN256,"Semillas Batlle - Sustrato Perlita 5 L, Color Blanco y turquesa",0,4.5,919,"https://images-eu.ssl-images-amazon.com/images/I/71Iv4CeojvL._AC_UL300_SR300,200_.jpg"
82,B09XJZKLSG,"Newaner Tijeras de podar, antideslizantes con mango de bloqueo, de reparación profesional de flores, multifuncionales para cortar ramas y ratán（verde）",0,4.3,699,"https://images-eu.ssl-images-amazon.com/images/I/6192Xm0KTZL._AC_UL300_SR300,200_.jpg"
83,B07LBVKQ4J,"MURIBROM Quimunsa Raticida Cebo Bloque EXPRÉS 200 gr de Veneno Ratones, Ratas y roedores",0,4.1,710,"https://images-eu.ssl-images-amazon.com/images/I/51-VIeVVKfL._AC_UL300_SR300,200_.jpg"
84,B09CH9TLT4,"Funda Para Muebles de JardíN,420d Oxford Funda Protectora Para Conjuntos de Muebles,Anti Viento Anti Uv Para Mesas Sillas Sofás Exterior Funda Protectoras,Funda Mesa Jardin Cuadrada (120*120*72cm)",0,4.3,2199,"https://images-eu.ssl-images-amazon.com/images/I/51EpZOWahyL._AC_UL300_SR300,200_.jpg"
85,B00ZFWQL9M,"Flower Abono Líquido Orquídeas 300 ml, Estimula Floración, Aumenta Defensas, Vitamina K3, Bajo en Sales, Fertilizante Universal para Cítricos, Limoneros y Mandarinas, Multicolor",0,4.4,505,"https://images-eu.ssl-images-amazon.com/images/I/71-XZ8XhBbL._AC_UL300_SR300,200_.jpg"
86,B01KOD7BPY,"WUNDERGARDEN 100 Grapas de sujeción de Acero para el Ajuste de Mallas geotextiles y Telas contra Malas Hierbas o Acampada - Pinchos para el Suelo - 150 x 25 mm - Ø 2,7 mm",0,4.3,1574,"https://images-eu.ssl-images-amazon.com/images/I/919CvSBOYML._AC_UL300_SR300,200_.jpg"
87,B0B7X8CN96,VANSHEIM Cubierta Sofa 3 Plazas Terraza Funda Sofá 3 Plazas Jardín Funda Protectora para Sofa de Jardin Fundas Impermeables para Muebles de Jardin Impermeable Anti UV Paño Polyester 200x99x61/89cm,0,4.6,3399,"https://images-eu.ssl-images-amazon.com/images/I/41y+KQHmgjL._AC_UL300_SR300,200_.jpg"
88,B07TQ9VXN1,"SanGlory Fundas para Muebles de Jardin Impermeable Funda Mesa Exterior Cubierta de Muebles, Cubierta de Mesa Rectangular, Anti-UV Funda para Mesa y Sillas de Jardin, 200x160x70cm",0,4.5,3299,"https://images-eu.ssl-images-amazon.com/images/I/51qOvTmVcaL._AC_UL300_SR300,200_.jpg"
89,B0CJHQ33KD,"WARDBES Repelente Ultrasónico de Plagas 4 Paquetes,100% Inofensivo para Mascotas y Humanos,Electrónico Repelente Mosquitos Insectos para Interiores Anti Cucarachas, Moscas,Mosquitos,Ratones,Arañas",0,5.0,2590,"https://images-eu.ssl-images-amazon.com/images/I/618FH1SawpL._AC_UL300_SR300,200_.jpg"
90,B07K19RNL8,"Velway Funda para Barbacoa Impermeable, Cubierta BBQ de Parrilla 210D Oxford Protector, Anti-Viento/Anti-Polvo/Anti-Humedad, Resistente al Desgarro/Agua/Lluvia/Nieve/Sol, 147x61x117cm Negro",0,4.3,2199,"https://images-eu.ssl-images-amazon.com/images/I/51-CdHp8iLL._AC_UL300_SR300,200_.jpg"
91,B00PQLMFFQ,Quimicamp 201805 - Cloro Antialga Quimiclor Tab.200G.201805,0,4.3,3000,"https://images-eu.ssl-images-amazon.com/images/I/613o+B1IPtL._AC_UL300_SR300,200_.jpg"
92,B07LBRSYCX,"Raticida en pasta de alta eficacia y potente atracción, indicado para interior y despensa. Veneno para ratas y ratones.",0,4.0,450,"https://images-eu.ssl-images-amazon.com/images/I/81p0Ni3sMiL._AC_UL300_SR300,200_.jpg"
93,B0847SBRLR,"Kärcher K 2 Universal Edition - Hidrolimpiadora de alta presión, presión 110 bar, caudal 360 l/h, pistola de alta presión, peso 3,8 kg, con cable eléctrico, amarillo",0,4.5,7695,"https://images-eu.ssl-images-amazon.com/images/I/51wPOS4eWuL._AC_UL300_SR300,200_.jpg"
94,B09MTH9897,"Landrip Funda Protectora para Mesa Rectangular, 420D Oxford Funda de Mesa de Exterior Impermeables Funda de Muebles Exterior, Anti-UV, 213x132x72cm",0,4.3,3899,"https://images-eu.ssl-images-amazon.com/images/I/51-5P11nKgL._AC_UL300_SR300,200_.jpg"
95,B0C43VK5TB,Cloro granulado Choque Aquapool 5 KG - Cloro granulado de disolución rápida - Dicloro granulado Puro,0,4.2,2695,"https://images-eu.ssl-images-amazon.com/images/I/61nCy2U8rqL._AC_UL300_SR300,200_.jpg"
96,B014MJ8J2U,"XLUX medidor Humedad Plantas, higrómetro de Suelo, Monitor de riego de Flores, para Plantas de Interior y Exterior, no se Necesitan baterías",0,4.4,1299,"https://images-eu.ssl-images-amazon.com/images/I/71rBE3r88DL._AC_UL300_SR300,200_.jpg"
97,B0BMV1Y698,"Lona Transparente Con Ojales,Lonas Transparente Impermeable Exterior, Resistente A La Intemperie Para Toldo Lluvia Muebles De JardíN,Granja,Pergolas,Terraza,Plastico Invernadero,Tienda De CampañA 2x4m",0,2.3,2899,"https://images-eu.ssl-images-amazon.com/images/I/81urGHuJhBL._AC_UL300_SR300,200_.jpg"
98,B00ID4TOIY,Semillas Batlle Espinaca GIGANTE DE INVIERNO,0,4.2,160,"https://images-eu.ssl-images-amazon.com/images/I/615U9-+IDxL._AC_UL300_SR300,200_.jpg"
99,B0BFFFQ8FX,"Mrrihand Funda Muebles Jardín Impermeable 280x204x106 cm, Funda Sofás Jardín Exterior 600D Tela Oxford Impermeable con Revestimiento de PU, Funda Mesa Jardín con Salida de Aire para Mesas y Sillas",0,4.0,4599,"https://images-eu.ssl-images-amazon.com/images/I/71IB0baXWoL._AC_UL300_SR300,200_.jpg"
100,B09HTXDW6X,"Tesosy Pack 6 Cojines para Sillas, Cojín Decorativo de Asiento 40 x 40 x 5 cm con Correas de Sujeción, Asiento Imitacionde Lino, Ideal para la Decoración de Jardín, Gris, Fabricado en España",0,4.1,2999,"https://images-eu.ssl-images-amazon.com/images/I/61VwwO7oNuL._AC_UL300_SR300,200_.jpg"
