asin,title,price,rating,num_reviews,img_link
B09DP2XV1V,OUILA Luz LED Armario Magnética con Sensor Movimiento 36 LEDs 4 Modos Luz LED Adhesiva USB Recargable 1000mAh Luz Nocturna pa,23.99,4.4,10.855,"https://images-eu.ssl-images-amazon.com/images/I/61rj03H1m-L._AC_UL900_SR900,600_.jpg"
B08LL4WX7X,"TVLIVE Tira LED, Luces LED Habitación 20 metros, LED Strip lights RGB, Sincronización Musical Bluetooth, 28 Modos, Control de",21.99,4.2,8.660,"https://images-eu.ssl-images-amazon.com/images/I/81H5hXVVQTL._AC_UL900_SR900,600_.jpg"
B005YY96IO,"Idena 8325058 - Cadena de luces LED con 80 LEDs en blanco cálido, con función de temporizador de 8 horas y transformador, par",2.99,4.5,3.677,"https://images-eu.ssl-images-amazon.com/images/I/71n7q8zHjlL._AC_UL900_SR900,600_.jpg"
B07ZCY9XZ9,"SLATOR Lámpara Escritorio LED, Flexo de Escritorio (Cuidado Ocular, Puerto USB, 5 Modos,10 Niveles de Brillo,Temporizador de ",28.99,4.4,9.132,"https://images-eu.ssl-images-amazon.com/images/I/41hkXRPrNIL._AC_UL900_SR900,600_.jpg"
B08GG42WXY,"Gritin 9 LED Luz de libro, Lampara Libro de Lectura con 3 Modos de Protección de Los Ojos - Atenuación Continua, Recargable, ",11.99,4.7,24.720,"https://images-eu.ssl-images-amazon.com/images/I/81n7M-T19NL._AC_UL900_SR900,600_.jpg"
B08QRQQ53T,"TP-Link Tapo L530E , Bombilla LED inteligente Wi-Fi, multicolor, regulable, E27, 8.7 W 806 lm, compatible con Alexa y Google ",14.99,4.4,5.000,"https://images-eu.ssl-images-amazon.com/images/I/61SUwH30ELL._AC_UL900_SR900,600_.jpg"
B0CC4W2BHG,"HOVVIDA Tira LED 10M, RGB 5050 Luces LED, 30 LED/Metro, APP y Mando a distancia, 300 LED, Modo de Música, Modo de Temporizaci",11.99,4.2,13.425,"https://images-eu.ssl-images-amazon.com/images/I/81QQzBpzaHL._AC_UL900_SR900,600_.jpg"
B0CG1YVW2Y,"Focos LED Exterior Solares con Sensor de Movimiento IP67 Impermeable Luz Solar Exterior Jardin, Lampara Solar Exterior con Mú",26.99,5.0,7,"https://images-eu.ssl-images-amazon.com/images/I/81gVm47kjSL._AC_UL900_SR900,600_.jpg"
B000QGM3YY,"Reality Erzwo - Lámpara de pie con interruptor de cable y pie, necesaria bombilla superior E27 de 150 W como máximo y en lect",19.99,4.3,7.579,"https://images-eu.ssl-images-amazon.com/images/I/51vFIYwKGQL._AC_UL900_SR900,600_.jpg"
B0BN438Z97,"OUILA Luz de Armario con Sensor Movimiento 25000mAh Recargable Luz Nocturna, 41CM Regulable Lampara LED Adhesiva para Gabinet",19.99,4.3,4.813,"https://images-eu.ssl-images-amazon.com/images/I/61d2JVNMFQL._AC_UL900_SR900,600_.jpg"
B08ZK85FQX,"Beaeet Tiras Led 20 Metros, Luces LED Sincronización de Música Bluetooth, Control de Aplicaciones, Remoto de 40 Botones, 5050",18.39,4.3,9.907,"https://images-eu.ssl-images-amazon.com/images/I/71zESptvEoL._AC_UL900_SR900,600_.jpg"
B09LV26CMS,"GARITE Luz Lectura, 10 LED Lámpara de Lectura con 3 Colores y Atenuación Continua, Protección Ocular USB Recargable y Largas ",11.99,4.5,3.504,"https://images-eu.ssl-images-amazon.com/images/I/61FLIHdJqfL._AC_UL900_SR900,600_.jpg"
B09XMZMP1N,"Liwqolx Tira LED 20 Metros, Luces LED Habitación 20M, RGB Bluetooth Tiras LED con Control Remoto y Inteligente Control de APP",17.59,4.3,7.162,"https://images-eu.ssl-images-amazon.com/images/I/815QJX3wE8L._AC_UL900_SR900,600_.jpg"
B09CGGDXT2,"Luz Nocturna Infantil, 2 Piezas Luz Nocturna con Luz Sensor 5 Niveles de Brillo 3 Modos de Iluminación, Luz Noche LED Enchufe",12.99,4.4,6.109,"https://images-eu.ssl-images-amazon.com/images/I/51J4n3bCspL._AC_UL900_SR900,600_.jpg"
B098732YH5,"Govee Tira de Luces LED con Cámara 3,8m para TV de 55-65 Pulgadas, WiFi Inteligente RGBIC, Funciona con Alexa, Google Assista",79.99,4.5,1.604,"https://images-eu.ssl-images-amazon.com/images/I/71zTeKSwmOL._AC_UL900_SR900,600_.jpg"
B09KRVN7XG,"TP-Link TAPO L520E - Bombilla LED Inteligente, Bombilla WiFi sin necesidad de Hub, Blanco Neutro 4000K, Regulable,E27, 8.7W/ ",9.99,4.3,3.473,"https://images-eu.ssl-images-amazon.com/images/I/516D4oTtSaL._AC_UL900_SR900,600_.jpg"
B07H5N365J,"Bonve pet Tiras LED RGB, para Habitación 10 Metros, Luces Bluetooth Musical con IR Control Remoto 40 Teclas y APP, 16 Million",16.99,4.2,2.930,"https://images-eu.ssl-images-amazon.com/images/I/81KT5TC4tsL._AC_UL900_SR900,600_.jpg"
B07L885X7F,"Joomer Luces de Navidad Solares Exterior, 200LED Solar Luces 8 Modos Impermeable Guirnaldas Luces Exterior Solar por Navidad ",34.99,4.3,15.608,"https://images-eu.ssl-images-amazon.com/images/I/81Tv+TiGefL._AC_UL900_SR900,600_.jpg"
B08QRTJF5B,"Tailcas Bombilla LED G9 5W, Blanco Calido 3000K, Sin Estroboscópico, LED Equivalente a la Bombilla Halógena de 50W, 500LM, AC",11.99,4.6,650,"https://images-eu.ssl-images-amazon.com/images/I/61yu-6q1Z1L._AC_UL900_SR900,600_.jpg"
B091CSCVRM,"Luz Solar Exterior [6 Paquete/3 Modes] SEZAC 270° Súper Brillante Focos Led con Sensor de Movimiento, IP65, para Jardin, Gara",42.99,4.3,6.771,"https://images-eu.ssl-images-amazon.com/images/I/81gg3grVniL._AC_UL900_SR900,600_.jpg"
B0BZ4D6LKP,yummici Luz Nocturna de Plástico Con Sensor - Luz Nocturna Para Armario Luz Armario Con Sensor Luces Led Sensor De Movimiento,5.01,4.0,365,"https://images-eu.ssl-images-amazon.com/images/I/51Ht8A935QL._AC_UL900_SR900,600_.jpg"
B0CB4TH87C,"Proyector Estrellas Astronauta，Galaxy Projector Starry Night Light，con Temporizador, Mando a Distancia y 360° Rotación Lampar",29.99,4.7,249,"https://images-eu.ssl-images-amazon.com/images/I/61KcLecwQkL._AC_UL900_SR900,600_.jpg"
B0C7D1Y9WN,"HABOWN® Lampara Techo,24W 3000K-6500K Plafones para Techo LED Regulable,3000LM IP40 Impermeable Plafon LED Techo Redonda con ",23.99,4.6,298,"https://images-eu.ssl-images-amazon.com/images/I/713l1wT4KYL._AC_UL900_SR900,600_.jpg"
B0BD382MFL,"Tira de luces LED para TV, kit de retroiluminación USB con control remoto, sincronización de aplicación con música, iluminaci",10.99,4.2,844,"https://images-eu.ssl-images-amazon.com/images/I/71PaWtmj65L._AC_UL900_SR900,600_.jpg"
B09FSKW8JS,"Flexo LED Escritorio Recargable USB, Lámpara Escritorio LED con Control Táctil, Flexo Escritorio con 3 Modos Brillos, Luz Lec",15.99,4.2,3.060,"https://images-eu.ssl-images-amazon.com/images/I/61g8r64T6jL._AC_UL900_SR900,600_.jpg"
B0B4R8ST3F,"GY 12 bombillas LED GU10, 8W equivalentes a 80W, blanco neutro 4000K, 800 lúmenes, larga duración, bajo consumo, aptas para i",20.39,4.6,3.004,"https://images-eu.ssl-images-amazon.com/images/I/515Ia7tyoHL._AC_UL900_SR900,600_.jpg"
B0CBPL4RKH,"Gritin 19 LED Luz de Lectura, 360° Flexible Ajustable Lámpara de Lectura Recargable, 3 Colores de Luz & 5 Brillos, Protección",13.99,4.8,606,"https://images-eu.ssl-images-amazon.com/images/I/71A3c74fhML._AC_UL900_SR900,600_.jpg"
B0B8G14XWN,"YOXISA Cortina Luces Navidad Exterior, 10M 480 LED Guirnalda Luces de Cascada, 8 Modos IP65 Impermeable Cadenas de Luces Led ",20.99,3.8,70,"https://images-eu.ssl-images-amazon.com/images/I/81Hrr0WZhwL._AC_UL900_SR900,600_.jpg"
B08QM7NMTG,"Luces Solares LED Exterior Jardin, 2 Pack Guirnaldas Luces Exterior Solar 2×12M 120 LED Impermeables Cadena de Luces Decoraci",16.99,4.0,7.668,"https://images-eu.ssl-images-amazon.com/images/I/71qW5DBU9cL._AC_UL900_SR900,600_.jpg"
B09JG9ZL7Y,"oxylops lámpara Led Escritorio, Flexo de Escritorio con luz nocturna, lampara de escritorio con control táctil, Puerto de car",27.99,4.4,1.558,"https://images-eu.ssl-images-amazon.com/images/I/41HQJgrtg-L._AC_UL900_SR900,600_.jpg"
B083DC9J5M,"Auxmir Lámpara de Mesita de Noche, Luz Nocturna Recargable con USB, 13 Colores de Luz, Control Remoto y Táctil Inalámbrico, T",14.99,4.4,20.656,"https://images-eu.ssl-images-amazon.com/images/I/51fksINbWYL._AC_UL300_SR300,200_.jpg"
B09DYNVSRM,"Luz Noche con Sensor de Luz, Luz Nocturna Infantil 5 Niveles Brillo Regulable 3 Modos (ON/AUTO/OFF), Luz Nocturna para Habita",8.99,4.5,4.783,"https://images-eu.ssl-images-amazon.com/images/I/41Ae6ArhniL._AC_UL300_SR300,200_.jpg"
B0BTVZG35S,Flexo LED Escritorio Cabeza Doble Lampara Escritorio 5 Modos y 10 Niveles de Brillo Lampara Estudio Cuidado Ocular Luz Escrit,20.99,4.4,947,"https://images-eu.ssl-images-amazon.com/images/I/71MXY7ACwSL._AC_UL300_SR300,200_.jpg"
B08395Q2CG,"Azhien Lámpara LED de Espejo 10W 820LM 40mm Lámpara de Baño, Blanco Frio 6500K Lámpara LED de Pared IP44 230V Luz de Espejo d",26.99,4.5,4.310,"https://images-eu.ssl-images-amazon.com/images/I/51TmZZFKImS._AC_UL300_SR300,200_.jpg"
B0BZH48K3H,"KagoLing Luz Solar Exterior, Foco Solar exterior [2 Paquete] 202 LED Split Lampara Solar Exterior con Mando a Distancia 3 Mod",36.99,4.6,300,"https://images-eu.ssl-images-amazon.com/images/I/81JkqOnAo6L._AC_UL300_SR300,200_.jpg"
B0B1CG4SV3,"M Ledme - Foco Proyector Led Napoli 50W, 6.000 lumen, IP65 Regulable, Color Luz fría (6000k), Iluminación exterior, De uso pa",13.80,4.0,586,"https://images-eu.ssl-images-amazon.com/images/I/61usLg1LHgL._AC_UL300_SR300,200_.jpg"
B098FJ6LXB,"TP-Link Tapo L900-5 - 5M Wi-Fi Tiras LED de 12 V, 16 millones de colores con 2100 mcd, óptimo para la familia, sincronización",17.99,4.5,6.252,"https://images-eu.ssl-images-amazon.com/images/I/61S84GH7pdL._AC_UL300_SR300,200_.jpg"
B096B5MYH5,"Govee Tira LED Alexa 5m, WiFi Luces LED Habitacion Inteligente RGB, Funciona con Alexa, Google Assistant y App, 64 Modos de E",21.99,4.2,1.007,"https://images-eu.ssl-images-amazon.com/images/I/71xAFiAbnEL._AC_UL300_SR300,200_.jpg"
B0C7BSZ83J,"Lámpara Escritorio LED, Plegable, 3 Modos y 5 Niveles de Brillo,Control Táctil con Carga USB, Flexo Lámpara de mesa Cuidado d",11.99,3.8,131,"https://images-eu.ssl-images-amazon.com/images/I/61-uO8qQv4L._AC_UL300_SR300,200_.jpg"
B08R8PP7Q9,"ANTELA Bombilla Inteligente LED E27 Wifi 9W Compatible Con Google Home/Alexa, Bombilla RGB(2700K-6500K) Luces Colores Regulab",16.99,4.4,15.986,"https://images-eu.ssl-images-amazon.com/images/I/61R5F8dbbjS._AC_UL300_SR300,200_.jpg"
B06Y3K5PYH,"Amazon Basics - Bombilla rosca Edison LED E27, 13 W (equivalente a 100 W), blanco frío, no regulable, paquete de 2, CRI80",9.43,4.3,15.737,"https://images-eu.ssl-images-amazon.com/images/I/61HeCyOM0UL._AC_UL300_SR300,200_.jpg"
B0B7BV1Y8L,"V-TAC 10x Bombillas LED E27, Edison - A60, 8,5W (Equivalente a 60W) - 806 Lumen - 4000K Blanco Neutro - Apertura del Haz de L",12.99,4.5,2.064,"https://images-eu.ssl-images-amazon.com/images/I/71JJmPzr4qL._AC_UL300_SR300,200_.jpg"
B07F892GV1,"Aigostar - Pack de 5 Bombillas LED PLC 2U, tubo de 11 W Maiz G24d-3, 2 Pines, Luz fría 6500K, 1070Lm, No regulable",21.99,4.2,1.780,"https://images-eu.ssl-images-amazon.com/images/I/710iDACrFCL._AC_UL300_SR300,200_.jpg"
B0B42ZVV8Y,"YIQAN 30cm Luz led para espejo, 230V Lámparas Iluminación IP44, Aplique de pared para baño",20.99,4.4,1.221,"https://images-eu.ssl-images-amazon.com/images/I/51KR6KromrL._AC_UL300_SR300,200_.jpg"
B09VNJYF9T,"OTREN Plafon Luz LED Techo 36W, Ø30CM Lampara Downlight Panel Superficie 6500K, 3240LM Plafones Modernas Redondo IP44 para Ba",25.99,4.5,1.219,"https://images-eu.ssl-images-amazon.com/images/I/61QqwH7qkTL._AC_UL300_SR300,200_.jpg"
B08PD2FQ14,"Aigostar Bombilla LED E27 12W, Luz blanca fría 6400K, 1020 lúmenes, Lámpara A60, Ángulo 280º, Ahorro de energía, No regulable",16.99,4.5,1.058,"https://images-eu.ssl-images-amazon.com/images/I/61znNt+X1rL._AC_UL300_SR300,200_.jpg"
B09BYZQY6S,"Luz Nocturna con Sensor de Movimiento, [2 Piezas] Luz Nocturna Infantil Regulable 3 Modos (ON/AUTO/OFF), Luz de Noche 3500K B",15.99,4.5,4.948,"https://images-eu.ssl-images-amazon.com/images/I/51mM34w6YZL._AC_UL300_SR300,200_.jpg"
B0BNV4S1ZG,"Luces Solares Con Sensor De Movimiento (4 Paquete/140 LED/3 Modos) IP65 Impermeable, Focos Led Exterior Para Jardín,Garaje,Ca",28.99,4.3,1.227,"https://images-eu.ssl-images-amazon.com/images/I/81cIsG2GMqL._AC_UL300_SR300,200_.jpg"
B08SQ1C6ZT,"Enteenly Tira LED TV, 3m Luces Habitación, TV RGB 5050, USB con Aplicación y Control Remoto para Retroiluminación de TV de 40",13.99,4.3,1.197,"https://images-eu.ssl-images-amazon.com/images/I/71VaFRGQ4fL._AC_UL300_SR300,200_.jpg"
B089GLV2KX,"Lámpara de pie, Tomshine luz de piso LED, Control Táctil, 3 temperaturas de colo Altos lúmenes, vida útil larga Luz de lectur",35.59,4.4,82,"https://images-eu.ssl-images-amazon.com/images/I/41Hz0uuHQLL._AC_UL300_SR300,200_.jpg"
B08LH5BZKN,"AmmToo 【3 Packs】 Guirnaldas Luces Exterior Solar, luces de hadas jardín Totalmente 36M 360 LED 8 Modos IP65 Cadena de Luces D",15.99,4.2,815,"https://images-eu.ssl-images-amazon.com/images/I/81vT0cXQvXL._AC_UL900_SR900,600_.jpg"
B085CHJ9BD,"SLATOR Lámpara Escritorio LED, Flexo de Escritorio, La luz natural protege los ojos, Lampara led Escritorio regulable con pue",27.99,4.4,3.751,"https://images-eu.ssl-images-amazon.com/images/I/41reFotSF8L._AC_UL900_SR900,600_.jpg"
B08D6GN5RX,"Tira LED 6 Metros, Luces LED Habitación 6M, RGB Tiras LED con Control Remoto y Inteligente Control de APP, Cambia el Color co",11.99,4.1,11.756,"https://images-eu.ssl-images-amazon.com/images/I/71LbDjHqneL._AC_UL900_SR900,600_.jpg"
B0BFLJ1W16,"M Ledme - Plafon LED Techo 30W, Lámpara Techo para Baño IP44, 3.000 lúmenes, Color Luz Neutra (4500K) para Baño, Cocina, Balc",11.99,4.4,355,"https://images-eu.ssl-images-amazon.com/images/I/31Lc75kuGHL._AC_UL900_SR900,600_.jpg"
B0C7FWMS7C,"Lámpara de Escritorio LED con Batería de 2000mAh, 5 Modos, 10 Niveles de Brillo, Temporizador de 30/60min, Función de Memoria",25.99,4.4,238,"https://images-eu.ssl-images-amazon.com/images/I/71XIYUEWUzL._AC_UL900_SR900,600_.jpg"
B01K207T7O,wonderlamp Downlight LED redondo extraplano 18W. 1450lm. Luz fría (6000°K). 30.000H. Color blanco (W-E000046),7.75,4.5,2.232,"https://images-eu.ssl-images-amazon.com/images/I/71MDr7Jn5kL._AC_UL900_SR900,600_.jpg"
B0BRZ8MKKC,"Gritin Luz de Lectura Cuello Recargable, Lampara de Lectura Libros Cama con Modo Memoria - 3 Colores Modos Protección Ocular,",13.99,4.7,861,"https://images-eu.ssl-images-amazon.com/images/I/612oe1UfPHL._AC_UL900_SR900,600_.jpg"
B0C4Y9VXF6,"sylvwin Lámpara de pared LED,Apliques Pared Interior con 3 Modos de Color y 3 Niveles de Brillo, Control Táctil,Luz de Pared ",19.99,4.6,129,"https://images-eu.ssl-images-amazon.com/images/I/71iSOyoPSfL._AC_UL900_SR900,600_.jpg"
B08GKRDKHC,"Guirnalda Luces Exterior Solar, 12M 100 LED Cadena de Luces de Navidad Solares Exteriores 8 Modos IP65 Impermeable Decoración",12.99,4.0,1.161,"https://images-eu.ssl-images-amazon.com/images/I/71UV61Cq4LL._AC_UL900_SR900,600_.jpg"
B07F38BXZG,"Pack 2x Pantalla Luminaria LED integrado, 120cm 40W. Color Blanco Frio (6500K). 4000 lumenes.",0,4.4,5.403,"https://images-eu.ssl-images-amazon.com/images/I/517SrSu15wL._AC_UL900_SR900,600_.jpg"
B0C7L6XN3S,"luz led con sensor de movimiento barra led lampara led,luz led armario luz nocturna 20CM luz led adhesiva 3Modos under cabine",5.59,4.1,396,"https://images-eu.ssl-images-amazon.com/images/I/51YU-avH35L._AC_UL900_SR900,600_.jpg"
B0BNVG9VMT,"Peasur Luz Solar Exterior【8 Paquete/138 LED/3 Modos】 Luces Solares Led Exterior con Sensor de Movimiento,IP65 Impermeable Foc",49.99,4.3,1.750,"https://images-eu.ssl-images-amazon.com/images/I/71P25IZ6VVL._AC_UL900_SR900,600_.jpg"
B08ZDDLJFB,"Luz Nocturna, Oreunik Luces LED Armario con Sensor Movimiento, Lámpara Nocturna Recargable(Auto/ON/OFF), Luz Cálida para Arma",13.99,4.3,4.183,"https://images-eu.ssl-images-amazon.com/images/I/51JGa6QEW+L._AC_UL900_SR900,600_.jpg"
B0BNKF39TX,"wonderlamp Rled - Pack 2 Bombillas Miniesfèrica Rosca fina E14, en Blíster, 6W, Luz Neutra, 470 lm, No Regulable",3.95,4.5,111,"https://images-eu.ssl-images-amazon.com/images/I/51dZKRucftL._AC_UL900_SR900,600_.jpg"
B0B59FCTH1,"Clomnpe Cadena de Luces Led 10M 100 LED, USB Guirnalda de Luminosa Navidad Blanco Cálido y Multicolor Regulable, 11 Modos, Lu",5.99,4.5,606,"https://images-eu.ssl-images-amazon.com/images/I/91l1hTNhwVL._AC_UL900_SR900,600_.jpg"
B078NY5Y21,LEDUNI - Panel LED circular 20W 2000LM Color Blanco Frio 6000K Angulo 120 IP20 OPAL Aluminio 225 * 28Hmm,11.50,4.3,2.378,"https://images-eu.ssl-images-amazon.com/images/I/41lftqUa6iL._AC_UL900_SR900,600_.jpg"
B07D8LPBJJ,"Aigostar - Bombilla LED 8W GU10, Luz calida 3000K, 640lm, Esmerilada, no regulable - Caja de 5 unidades",11.99,4.3,6.603,"https://images-eu.ssl-images-amazon.com/images/I/61UCk7tGsaL._AC_UL900_SR900,600_.jpg"
B09M2ZGHVF,"Owwasd Guirnaldas Luces Exterior Solar, 120LED 14M 8 Modos, Cadena de Luces Impermeable, Decoracion para Terraza, Fiestas, Bo",16.99,4.2,801,"https://images-eu.ssl-images-amazon.com/images/I/71ivFEfAfxL._AC_UL900_SR900,600_.jpg"
B0881G72JN,"Mexllex Luces LED 15m, Tiras LED RGB Colores Luces Habitacion con Control Remoto y App Control, Cambia el Color con la Musica",15.99,4.1,18.909,"https://images-eu.ssl-images-amazon.com/images/I/71Apda4tmLL._AC_UL900_SR900,600_.jpg"
B077XXDL8M,"InnovaGoods® Lampara de Lava, Lámpara de Lava Relajante, Lamparas de mesita de noche, Funciona con una bombilla R39 de 25W, i",13.07,4.2,4.924,"https://images-eu.ssl-images-amazon.com/images/I/61NjajU-WYL._AC_UL900_SR900,600_.jpg"
B0BHZ8M1J6,Nestling Luz Nocturna Bebé Niños Luz Táctil LED Lampara Bebe de Silicona Kawaii Chick USB Recargable - Regalos para Niñas Niñ,14.43,4.5,436,"https://images-eu.ssl-images-amazon.com/images/I/51clWknO9TL._AC_UL900_SR900,600_.jpg"
B07CZH8PQS,ACED Lampara luna Luna lampara 2023 Actualización 16 Color Con soporte de madera/Lejano/Control táctil Un regalo para una niñ,29.99,4.4,1.417,"https://images-eu.ssl-images-amazon.com/images/I/61IgPWjUJUL._AC_UL900_SR900,600_.jpg"
B0BBMK7RCF,iZELL 23 LED Luz Lectura con Clip [3 Colores y 10 Brillos] Flexo LED Escritorio con Pinza 99.99% Bloqueo de Luz Azul Lámparas,15.29,4.5,1.819,"https://images-eu.ssl-images-amazon.com/images/I/619XsJ3fA8L._AC_UL900_SR900,600_.jpg"
B0C3R3YLK2,"Focos Led Exterior 100W, Iluminación de Exterior Seguridad,7000K Blanco Frío, Proyector LED Exterior,IP67 Impermeable 10000LM",28.99,4.4,55,"https://images-eu.ssl-images-amazon.com/images/I/61dWqCc9s4L._AC_UL900_SR900,600_.jpg"
B0196IJF70,"LE 10m 100 LED Luces de Hadas Blanco Cálido con Enchufe, Guirnalda de Luces Exteriores Impermeable IP65, Luz de Decoración Al",15.99,4.3,3.784,"https://images-eu.ssl-images-amazon.com/images/I/71iruGRNwWL._AC_UL900_SR900,600_.jpg"
B09DPJQGNX,"Suright Guirnalda Luces, 2 x 12M Luces LED Pilas Impermeable Exterior Interior, 120 LED Cadena Luces LED Decoración para Navi",10.49,4.2,1.549,"https://images-eu.ssl-images-amazon.com/images/I/811w-zC4a5L._AC_UL900_SR900,600_.jpg"
B08J43TZM2,"Vicloon Iluminacion Luz sin cables Portatil, 3 Pc Luz Armario con Sensor de Movimiento con Auto en/Apagado, USB Recargable LE",18.99,4.3,3.251,"https://images-eu.ssl-images-amazon.com/images/I/61f6-kYobuL._AC_UL900_SR900,600_.jpg"
B0BTJ5WSJ6,Aigostar - Foco proyector LED solar con mando a distancia，50W，6500K luz blanca.Resistente al agua IP66.Perfectos para interio,33.99,4.2,349,"https://images-eu.ssl-images-amazon.com/images/I/716DZnBQD0L._AC_UL900_SR900,600_.jpg"
B0B976XN3F,"One Fire Lampara Táctil de Mesita de Noche, 10 Color Dimmable Luz Nocturna Infantil, Recargable Portátil, Remoto+Temporizador",16.99,4.4,990,"https://images-eu.ssl-images-amazon.com/images/I/61LguPxxwzL._AC_UL900_SR900,600_.jpg"
B08YYQGTGX,"Lámpara Escritorio, USB Flexo LED con 5 Niveles de Brillo y 5 Modos, Temporizador de 30/60min, Cuidado Ojos, Función de Memor",21.99,4.3,1.249,"https://images-eu.ssl-images-amazon.com/images/I/61xNc1XiwDL._AC_UL900_SR900,600_.jpg"
B084M77TFQ,"AROMASENSES.- Lámpara de Sal del Himalaya con Base de Madera, Cable y Bombilla - Natural 100% -Hecha a Mano (2-3 Kg)",16.50,4.7,1.786,"https://images-eu.ssl-images-amazon.com/images/I/41UMl57LbVL._AC_UL300_SR300,200_.jpg"
B0BXKJ5W2H,"WeBeqer Lámpara Solare para Exteriore, 208 LED Focos Exterior Solar con Detector de Movimiento, 3 Modos de Lámparas Solares, ",18.99,4.5,192,"https://images-eu.ssl-images-amazon.com/images/I/719cUhSNdmL._AC_UL300_SR300,200_.jpg"
B0BL729KGG,"Aigostar Bombilla Inteligente, Bombilla Wifi G45 E14 6.5W, Bombilla Led Inteligente RGBCW Compatible con Alexa/Google Home, N",8.99,4.0,197,"https://images-eu.ssl-images-amazon.com/images/I/51beL9ADR3L._AC_UL300_SR300,200_.jpg"
B0BXDD8T7Z,"KEWUZY 6-pack Luz Nocturna Sensor Movimiento Recargable por USB, de Armario, 8 LED, 3 Modos (Auto/On/Off) para Armarios, Pasi",16.99,3.8,234,"https://images-eu.ssl-images-amazon.com/images/I/61KIfWneenL._AC_UL300_SR300,200_.jpg"
B07XFLJPD2,"Vintage Lámpara Edison, ASANMU LED E27 ST64 4W (Equivalente a 40W) 2500K, Blanco/Ambar Cálido, Bombillas Incandescentes para ",14.69,4.5,1.237,"https://images-eu.ssl-images-amazon.com/images/I/71UWJ6pIj-S._AC_UL300_SR300,200_.jpg"
B0BHP6XVTK,"YUNLEX Luz Noche con Enchufe 2 Piezas LED Luz Nocturna Infantil con Sensor Crepuscular, Brillo de nivel 3, Muy adecuado para ",12.79,4.6,771,"https://images-eu.ssl-images-amazon.com/images/I/41NxK-f7sfL._AC_UL300_SR300,200_.jpg"
B08JLDK6S5,"Bonve Pet Tiras Led, Luces Led 6 Metros, Luces Led Habitación Controlas con App y Control Remoto, Tiras led RGB 5050, 16 Mill",11.99,4.2,3.588,"https://images-eu.ssl-images-amazon.com/images/I/81Ae9oOwl2L._AC_UL300_SR300,200_.jpg"
B07WNRN9WQ,"Glocusent Luz de Lectura, Lampara Libro de Lectura Recargable, 3 Colores, 6 Niveles de Iluminación, Brazos Flexibles, Larga D",24.64,4.6,101.778,"https://images-eu.ssl-images-amazon.com/images/I/61ZsbUb56BS._AC_UL300_SR300,200_.jpg"
B09MCZN7TD,"Diyife Tira LED TV, [Inteligente/Bluetooth Control de App] LED para TV, Luces LED Habitacion, Luces LED TV,16 Millones de Col",11.99,4.3,1.041,"https://images-eu.ssl-images-amazon.com/images/I/71Uw8Jvu9NL._AC_UL300_SR300,200_.jpg"
B07JW1LM88,"Luz de Nocturna Led, Lámpara de Mesita de Noche Control Tactil Regulable Usb Recargable Cambio de Color Rgb para Niños Habita",15.98,4.3,18.473,"https://images-eu.ssl-images-amazon.com/images/I/519ylhv5CrL._AC_UL300_SR300,200_.jpg"
B09FHSZ5PD,"Velamp Bombilla incandescente, ST26, 15W / 100lm, base E14, 3000K. Hornos especiales",1.90,4.3,65,"https://images-eu.ssl-images-amazon.com/images/I/61eVMArHDRL._AC_UL300_SR300,200_.jpg"
B07WMMVL89,Yizhet Luces de Cortina 3m x 3m 300 LED Cortina Luces Navidad 8 Modos Cortina Luces LED con Mando Luz de Cortina Impermeable ,16.98,4.3,6.451,"https://images-eu.ssl-images-amazon.com/images/I/81mxSr8C01L._AC_UL300_SR300,200_.jpg"
B0C4L9HK2K,"Caja de Luz A4 Rosa con 400 Letras, Divertidos Emojis y 2 Rotuladores | Ñ y Ç Incluidas| Cartel Luminoso LED Ideal para Decor",22.99,4.6,295,"https://images-eu.ssl-images-amazon.com/images/I/81CYBWVFggL._AC_UL300_SR300,200_.jpg"
B07B8NWMMN,"24 LED Velas Velas CR2032 pilas velas sin llama,Velas de té,Velas LED,Velas parpadeantes,Velas Artificiales realistas a Pilas",11.99,4.4,5.248,"https://images-eu.ssl-images-amazon.com/images/I/51-Zgv-IgxL._AC_UL300_SR300,200_.jpg"
B093V8B61H,"MERTTURM Luz de Armario 160LED, USB Recargable Luces con Sensor de Movimiento, Brillo Regulable con 3 colores, Super brillant",19.99,4.3,3.256,"https://images-eu.ssl-images-amazon.com/images/I/61QGSevMw-S._AC_UL300_SR300,200_.jpg"
B0BD5YNNN8,"OneUan- Panel Downlight LED Redondo 20W 2200LM 6000K, Extraplano Empotrar en Techo Interior, Díametro 220mm, Luz Blanco Frió,",9.99,4.5,195,"https://images-eu.ssl-images-amazon.com/images/I/51QqQjetmYL._AC_UL300_SR300,200_.jpg"
B08BYLMK7C,"One Fire Lampara Proyector Estrellas Bebe, 84 Modos Luz Nocturna Infantil con Control Remoto, Música Proyector Bebes Luces y ",24.91,4.3,5.428,"https://images-eu.ssl-images-amazon.com/images/I/71A8f91uqrL._AC_UL300_SR300,200_.jpg"
B0BK13DDHN,"Hapfish Lampara led escritorio con abrazadera, 78cm 24W lámpara flexo de fuente de luz doble, con sensor de luz, 5 temperatur",59.99,4.5,647,"https://images-eu.ssl-images-amazon.com/images/I/61KWHt9p+CL._AC_UL300_SR300,200_.jpg"
B08HV2JNNN,"SKYLEO Lampara Escritorio LED - Flexo, Potente con clip - Protección ocular - 3 modos de luz X 10 niveles de brillo - Negro",25.49,4.3,466,"https://images-eu.ssl-images-amazon.com/images/I/61+M7Z-G-HS._AC_UL300_SR300,200_.jpg"
B07QS1R7WB,"EACLL GU10 Bases para Lámparas, Casquillo Portalámparas Zócalo de Cerámica, Pack de 10, Económico y práctico, Con Cable de Si",8.99,4.6,1.215,"https://images-eu.ssl-images-amazon.com/images/I/810zPnA-PfL._AC_UL300_SR300,200_.jpg"
