asin,title,price,rating,num_reviews,img_link
B005ZPEZ9W,Hohner 9508 Flauta de Plástico,10.77,4.7,4.276,"https://images-eu.ssl-images-amazon.com/images/I/517Mm2vL1vL._AC_UL900_SR900,600_.jpg"
B0002M6CVC,"Ernie Ball Regular Slinky - Cuerdas para guitarra eléctrica, entorchado de níquel, calibre 10-46",5.90,4.7,102.053,"https://images-eu.ssl-images-amazon.com/images/I/81wMsbKBB9L._AC_UL900_SR900,600_.jpg"
B000EEL6J6,"D'Addario Cuerdas Guitarra Española - EJ45 Pro-Arte, cuerdas de nailon para guitarra clásica, tensión normal",12.80,4.6,27.634,"https://images-eu.ssl-images-amazon.com/images/I/8169k0GrNyL._AC_UL900_SR900,600_.jpg"
B01N5IBOSF,"CASCHA HH 2018 Afinador cromático para guitarra, bajo, violín y ukelele",6.90,4.3,1.809,"https://images-eu.ssl-images-amazon.com/images/I/41pKiXVd41L._AC_UL900_SR900,600_.jpg"
B000EEJ91I,D'Addario EXL110-3D - Juego de cuerdas para guitarra eléctrica de acero y níquel (pack 3 juegos),19.40,4.7,32.551,"https://images-eu.ssl-images-amazon.com/images/I/61P6nokzrnL._AC_UL900_SR900,600_.jpg"
B002O38LD4,Ibiza - SMOKE5L-HD - Líquido para máquina de humo de alta densidad - 5 litros,15.90,4.5,4.838,"https://images-eu.ssl-images-amazon.com/images/I/51-kXuT+OgL._AC_UL900_SR900,600_.jpg"
B084MG7WNP,"Cuerdas de nailon de primera calidad para guitarra clásica, española, flamenca y guitarra acústica (lote de 6 cuerdas) BONUS:",9.99,4.5,1.407,"https://images-eu.ssl-images-amazon.com/images/I/61Pfw77PlFS._AC_UL900_SR900,600_.jpg"
B0BVMFV1X3,"VOVIGGOL Micrófono Inalámbrico Solapa para iPhone iPad Android Ordenador, Mini Microfono Inalambrico para Movil, Portátil Mic",17.84,3.9,255,"https://images-eu.ssl-images-amazon.com/images/I/51fDPnPEusL._AC_UL900_SR900,600_.jpg"
B07CNV5J2W,WiNGO Cejilla Guitarra Española Electricas Clásica Profesional Clasica Guitar Capo Ligero Aleación de Aluminio con 5 Púas de ,8.99,4.7,43.348,"https://images-eu.ssl-images-amazon.com/images/I/619a2m5GqrL._AC_UL900_SR900,600_.jpg"
B071VTDG6M,"CASCHA HH 2032 - Baquetas profesionales para batería, 5A, 1 par (2 piezas), madera de arce",2.90,4.2,2.189,"https://images-eu.ssl-images-amazon.com/images/I/51Ok0z7OAiL._AC_UL900_SR900,600_.jpg"
B002PZXVRM,"Stagg Cable de micrófono a mezclador Stagg SMC6 XLR (m) -XLR (f) de 6 metros de largo, negro",9.29,4.7,20.269,"https://images-eu.ssl-images-amazon.com/images/I/61Xs1iZwvCL._AC_UL900_SR900,600_.jpg"
B0BW5QNMC2,Cejilla Guitarra Española Cejilla Guitarra Acustica Capo Guitarra Aleación de Aluminio para Guitarra Electrica Acústica Clási,4.99,4.5,64,"https://images-eu.ssl-images-amazon.com/images/I/71++36iDdaL._AC_UL900_SR900,600_.jpg"
B0718WWSW7,Zoweetek® Amplificador portatil (10W) con 1800 mAh batería de Litio con un microfono para guías Maestros Profesores Artistas ,36.99,4.4,1.587,"https://images-eu.ssl-images-amazon.com/images/I/71c-EFOv8kL._AC_UL900_SR900,600_.jpg"
B006L4DLW8,"Martin Smith Ukelele soprano con bolsa de ukelele, Color Negro, 53 x 7 x 17 cm",24.99,4.1,13.688,"https://images-eu.ssl-images-amazon.com/images/I/81D1xI22xQL._AC_UL900_SR900,600_.jpg"
B07S9996N1,GLEAM Atril para Partituras - 2 en 1 Soporte para Libros de Escritorio de Doble Uso Atril para Partituras Plegable con Bolsa ,16.99,4.3,4.884,"https://images-eu.ssl-images-amazon.com/images/I/61EL+sB6zKL._AC_UL900_SR900,600_.jpg"
B0002H0JZC,D'Addario Cuerdas para Guitarra Española | EJ27N Juego de Cuerdas Clásica de Nylon,9.70,4.5,21.231,"https://images-eu.ssl-images-amazon.com/images/I/81orrvEAPFL._AC_UL900_SR900,600_.jpg"
B0002DV6TO,"Ernie Ball Earthwood Rock and Blues - Cuerdas para guitarra acústica, bronce 80/20, con cuerda Sol lisa, calibre 10-52",7.30,4.6,29.699,"https://images-eu.ssl-images-amazon.com/images/I/81ABSIL-d7L._AC_UL900_SR900,600_.jpg"
B001FC0HV4,"GEWA BSX 536500, Banquito Apoya Pie para Guitarristas, Negro, Altura entre 12 - 23 cm",6.90,4.5,3.361,"https://images-eu.ssl-images-amazon.com/images/I/71MItgoHWvL._AC_UL900_SR900,600_.jpg"
B07QR6Z1JB,"Interfaz de audio USB Scarlett Solo 3.ª gen. de Focusrite para guitarristas, cantantes y productores, con todo el software ne",89.00,4.7,40.873,"https://images-eu.ssl-images-amazon.com/images/I/614BVuQ9KvL._AC_UL900_SR900,600_.jpg"
B0CD3RZCJG,"Reditainer Micrófono de Solapa Inalámbrico Plug&Play para iPhone/iOS/Android, Microfono Inalambrico para Youtube, Facebook, T",29.99,4.7,6.199,"https://images-eu.ssl-images-amazon.com/images/I/61gMlx1N9hL._AC_UL900_SR900,600_.jpg"
B0BXPFNNF9,"COCONISE Micrófono Gaming RGB, Microfono Pastilla cardioide para PC Mac PS4 PS5, Mute Touch, Equipado con Conector para Auric",36.99,4.5,385,"https://images-eu.ssl-images-amazon.com/images/I/71QclY4ig4L._AC_UL900_SR900,600_.jpg"
B0BZPSDCJZ,Hercules DJControl Inpulse 200 MK2 Controladora de DJ optimo para aprender a mezclar,119.99,0.0,0,"https://images-eu.ssl-images-amazon.com/images/I/81PDE7-KmmL._AC_UL900_SR900,600_.jpg"
B0030LLPFK,"Roland Auriculares Roland RH-5 — Auriculares de monitorización, diseño cerrado y escucha concentrada",30.30,4.5,5.257,"https://images-eu.ssl-images-amazon.com/images/I/61ssGNdb5kL._AC_UL900_SR900,600_.jpg"
B08QV3CC8L,"Luces Discoteca, Gritin Rotación de 360° Activada por Sonido Luces de Fiesta de Bola de Discoteca con Control Remoto- 3W RGB ",14.99,4.4,5.131,"https://images-eu.ssl-images-amazon.com/images/I/71mdBIGC5nL._AC_UL900_SR900,600_.jpg"
B01C5G2TQY,"RockJam Soporte de guitarra RockJam portátil universal en forma de A para guitarra acústica, guitarra eléctrica y bajo",14.99,4.6,27.687,"https://images-eu.ssl-images-amazon.com/images/I/61tve-sSDxL._AC_UL900_SR900,600_.jpg"
B0BD8BX1DC,"15 Piezas Púas para Guitarra con una caja resistente de almacenaje, Púas de Celuloide para Guitarras Eléctricas, Clásica, Acú",3.99,4.6,620,"https://images-eu.ssl-images-amazon.com/images/I/71-FlsKWQ4L._AC_UL900_SR900,600_.jpg"
B09GM22PMP,"Bola Luces Discoteca LED, 7 Colores RGB Luz con Sonido Activado, 4M Cable USB, Rotación de 360 , Ideal para Cumpleaños, Disco",16.99,4.5,2.359,"https://images-eu.ssl-images-amazon.com/images/I/71DDhvQBRpL._AC_UL900_SR900,600_.jpg"
B0030LVCDK,"Stagg SAC3PS DL - Cable para instrumentos para Micrófono (simétrico, 3 m) color negro",5.99,4.3,2.236,"https://images-eu.ssl-images-amazon.com/images/I/616EioOnCRL._AC_UL900_SR900,600_.jpg"
B01ARSSSA8,Ortega Guitars Ortega Osw-Std - Manivela para guitarra,1.59,4.3,613,"https://images-eu.ssl-images-amazon.com/images/I/71mgHq2g-aL._AC_UL900_SR900,600_.jpg"
B07FDL3NGT,"RockJam Teclado RockJam compacto de 61 teclas con soporte para partituras, fuente de alimentación, pegatinas para notas de pi",59.99,4.4,15.251,"https://images-eu.ssl-images-amazon.com/images/I/819oylJWefL._AC_UL900_SR900,600_.jpg"
B00PLPOCFI,Gato Negro - Cuerdas para guitarra,11.53,4.6,2.390,"https://images-eu.ssl-images-amazon.com/images/I/61RdEPn5vBL._AC_UL300_SR300,200_.jpg"
B072J49RNL,"OneOdio Pro10 Auriculares DJ con Cable, Estéreo de Mezcla y Monitor de Estudio, 50mm Controladores, 3.5 y 6.35mm Conector de ",34.99,4.4,5.381,"https://images-eu.ssl-images-amazon.com/images/I/811RreTN3rL._AC_UL300_SR300,200_.jpg"
B076PPC9W6,"NGS Singer Fire - Micrófono Vocal Dinámico, Micrófono con Cable de 3 Metros, Conexión Jack 6,3mm y Botón On/Off",8.99,4.2,2.094,"https://images-eu.ssl-images-amazon.com/images/I/61dJC09FgaL._AC_UL300_SR300,200_.jpg"
B01IBI88R4,"D'Addario Afinador de Guitarra - Eclipse Headstock Tuner - Afinador de Guitarra Española, Afinador Guitarra Eléctrica - Negro",11.90,4.4,10.177,"https://images-eu.ssl-images-amazon.com/images/I/71eGojrnvVL._AC_UL300_SR300,200_.jpg"
B000A6EUSW,"Elixir Cuerdas de guitarra acústica Strings de bronce fosforado con recubrimiento NANOWEB, calibre ligero personalizado (.011",16.90,4.5,27.904,"https://images-eu.ssl-images-amazon.com/images/I/91H2H61WIfL._AC_UL300_SR300,200_.jpg"
B06XSK85NK,Hannabach 500MT - Cuerdas de guitarra clásica,6.50,4.3,801,"https://images-eu.ssl-images-amazon.com/images/I/61sbsdbzqDL._AC_UL300_SR300,200_.jpg"
B0002D0E92,"Ernie Ball - Correa para guitarra, polipropileno, color negro",6.90,4.6,24.586,"https://images-eu.ssl-images-amazon.com/images/I/51MBcZ1nzHL._AC_UL300_SR300,200_.jpg"
B00R41HZWE,"Navarrez NV11 guitarra clásica marrón 4/4, bolsa/Gig Bag, 2 púas",59.00,4.2,6.476,"https://images-eu.ssl-images-amazon.com/images/I/71POCu-YqmL._AC_UL300_SR300,200_.jpg"
B06XF6NF5Y,RockJam Banco de teclado RockJam Premium acolchado ajustable o Taburete de piano digital,39.99,4.6,41.656,"https://images-eu.ssl-images-amazon.com/images/I/81Kbf7j8TUL._AC_UL300_SR300,200_.jpg"
B00422VXSA,"PURE GEWA GEWA F900520 - Soporte de teclado, patas perfil simple,negro",28.04,4.4,3.383,"https://images-eu.ssl-images-amazon.com/images/I/61XETdXOAeL._AC_UL300_SR300,200_.jpg"
B07XNX9BQ4,SONICAKE Adaptador de fuente de alimentación del pedal Accesorio para guitarra o bajo 9V DC 1000mA 1A,11.99,4.4,475,"https://images-eu.ssl-images-amazon.com/images/I/51a8VzF38bS._AC_UL300_SR300,200_.jpg"
B073TDCRHT,"Soporte Guitarra 2 Piezas Oporte, Hanger Hakenhalter Wandhalterung Colgador de Guitarra Eléctrica Acustica Tamaño Ajustable P",7.99,4.5,2.804,"https://images-eu.ssl-images-amazon.com/images/I/51vt5u24yDL._AC_UL300_SR300,200_.jpg"
B0002F741Q,Vic FIrth - Baquetas de la serie American Classic® 5A - Madera de nogal American - Punta de Madera,14.00,4.7,16.226,"https://images-eu.ssl-images-amazon.com/images/I/61tVtiVZQGL._AC_UL300_SR300,200_.jpg"
B0872TGQQT,CAHAYA 2-EN-1 Soporte para Partituras Plegable & Atril de Escritorio para Libros Atril para Partituras Portátil con Altura Aj,22.99,4.6,9.463,"https://images-eu.ssl-images-amazon.com/images/I/7137hlPNhYL._AC_UL300_SR300,200_.jpg"
B0CB2HGR9Q,"RØDE Wireless PRO es un sistema de micrófono inalámbrico compacto increíblemente potente con timecode, grabación en 32 bits d",448.13,4.4,5.084,"https://images-eu.ssl-images-amazon.com/images/I/41qkBpwVHKL._AC_UL300_SR300,200_.jpg"
B07BMQMF9N,CAHAYA Funda para Guitarra Acústica Estuche para Guitarra 41 42 Pulgadas,26.99,4.5,11.008,"https://images-eu.ssl-images-amazon.com/images/I/61zTQVs3vxL._AC_UL300_SR300,200_.jpg"
B07QK1DMLZ,"Tiger Mad About SU8 Ukelele soprano en azul claro con estuche, púa y cuerdas de repuesto, óptimo para escuelas y principiante",28.99,4.4,4.601,"https://images-eu.ssl-images-amazon.com/images/I/718-SXMFQ8L._AC_UL300_SR300,200_.jpg"
B09J4LQQPN,"Luces de discoteca, luces de fiesta, luces LED RGB activadas por sonido para DJ, mini luz estroboscópica con control remoto p",41.99,4.0,1.113,"https://images-eu.ssl-images-amazon.com/images/I/71THZ0MPEsL._AC_UL300_SR300,200_.jpg"
B08RD1TPXM,CAHAYA Atril Musica Extensible & Atril Sobremesa 2-EN-1 Ajustable de 80-145cm Soporte para Partituras Plegable,29.99,4.7,567,"https://images-eu.ssl-images-amazon.com/images/I/610xAybOOGL._AC_UL300_SR300,200_.jpg"
B00IZCSX9U,"D'Addario Cuerdas Guitarra Electrica | Cuerdas de Guitarra | Cuerdas para Guitarra Eléctrica | NYXL1046 Nickel Wound, Regular",14.80,4.6,8.559,"https://images-eu.ssl-images-amazon.com/images/I/81hSpHAXT4L._AC_UL300_SR300,200_.jpg"
B0BYJ7GSM3,"Espuma Acústica Pack 12 Paneles, Paneles Acústicos Hexagonales con Respaldo Adhesivo, Insonorizacion Acustica Pared y Decorac",29.99,4.3,170,"https://images-eu.ssl-images-amazon.com/images/I/618GvDUqRLL._AC_UL900_SR900,600_.jpg"
B00C7G4SF8,FLAUTA DULCE HOHNER - Madera,12.77,3.9,27,"https://images-eu.ssl-images-amazon.com/images/I/41mn8n6007L._AC_UL900_SR900,600_.jpg"
B079CFR7SV,"POSUGEAR Cable Jack 6.3 Estereo 2M, Profesional Cable Audio Jack 6.35mm a 6.35mm Macho Macho Cable Guitarra Electrica Nylon T",9.99,4.4,5.929,"https://images-eu.ssl-images-amazon.com/images/I/61agInnXBfL._AC_UL900_SR900,600_.jpg"
B0CG1DNC35,"Ryzwoc K1 Micrófono Inalámbrico para iPhone, 2,4 GHz Wireless Micro para Móvil para Youtube/Vlogging, Micrófono Inalámbrico W",19.99,4.3,1.336,"https://images-eu.ssl-images-amazon.com/images/I/51Whpmc5nPL._AC_UL900_SR900,600_.jpg"
B07987K4F5,"Alesis Melody 61 - Teclado de piano electrico para principiantes con altavoces, soporte, banqueta, auriculares, micrófono, at",119.00,4.5,25.061,"https://images-eu.ssl-images-amazon.com/images/I/81Dc+-iIqsL._AC_UL900_SR900,600_.jpg"
B000EEJ8CS,"D'Addario EJ16, cuerdas de bronce fosforado para guitarra acústica, blandas, 12-53",10.90,4.6,17.018,"https://images-eu.ssl-images-amazon.com/images/I/81nzPy5yOYL._AC_UL900_SR900,600_.jpg"
B0096SB222,"Ibiza - PORT15VHF-BT - Altavoz portátil 15""/800W MAX con 2 micrófonos (VHF), Mando a Distancia y Funda Protectora - Bluetooth",299.00,4.3,7.830,"https://images-eu.ssl-images-amazon.com/images/I/81Hct1h2hoL._AC_UL900_SR900,600_.jpg"
B0BYD6GY7N,"New Bee cable de guitarra 10ft Cable de instrumento eléctrico de bajo AMP para mandolina eléctrica, audio profesional (ángulo",7.59,4.6,1.540,"https://images-eu.ssl-images-amazon.com/images/I/71iyVlJ0HEL._AC_UL900_SR900,600_.jpg"
B0030GMFLI,Tiger GGB7-FAC - Funda para guitarra acústica,14.49,4.0,1.459,"https://images-eu.ssl-images-amazon.com/images/I/71Dojr+7OnL._AC_UL900_SR900,600_.jpg"
B00REB9VTO,"Alpine PartyPlug Tapones para los oídos para Fiestas, festivales de música y conciertos - Cómodo material hipoalergénico + Co",13.95,4.2,6.944,"https://images-eu.ssl-images-amazon.com/images/I/7175NifTFtL._AC_UL900_SR900,600_.jpg"
B001U79JW2,Hohner b9508 Melody Flauta soprano plástico alemán,8.85,4.5,211,"https://images-eu.ssl-images-amazon.com/images/I/41p8aUQFA9L._AC_UL900_SR900,600_.jpg"
B0921W59N5,"EASTROCK Flauta Dulce Soprano,Flauta de pico,ABS,Digitación Alemana,Flauta Escolar,Plásticopara Escuela o Clase de Musica,Neg",11.68,4.5,918,"https://images-eu.ssl-images-amazon.com/images/I/6128Yf3dZTS._AC_UL900_SR900,600_.jpg"
B06XJ4X8HL,"Stylineedle Paquete de 2 Agujas con Punta de Diamante para Tocadiscos Crosley, Ion, Jensen, Bush y Teac",7.99,4.3,866,"https://images-eu.ssl-images-amazon.com/images/I/61Z2Igg2cbL._AC_UL900_SR900,600_.jpg"
B0CFZSZX7H,"Aichoof Micrófono Inalámbrico,Micrófono Lavalier Inalámbrico para iOS,Mini Micrófono portátil Plug-Play,grabación de Audio pa",31.99,4.8,15.681,"https://images-eu.ssl-images-amazon.com/images/I/71N+c8IKmQL._AC_UL900_SR900,600_.jpg"
B0BJXTX7BK,"Flauta dulce soprano set de 3 piezas, incluye varilla de limpieza, tabla de dedos y funda tipo estuche de color verde para us",11.97,3.8,31,"https://images-eu.ssl-images-amazon.com/images/I/71-J+4MX0eL._AC_UL900_SR900,600_.jpg"
B08K8MMWS2,"Giecy Amplificador de Voz portátil con micrófono 30W batería Recargable 2800mah, Sistema de megafonía, Amplificador Voz Liger",53.98,4.2,793,"https://images-eu.ssl-images-amazon.com/images/I/719uK8vukeL._AC_UL900_SR900,600_.jpg"
B07VQPLL66,"Amplificador de Voz, Sistema de PA Recargable de 12 Vatios (1200 mAh) con Micrófono con Cable para Profesores, Guía Turístico",29.99,4.3,2.368,"https://images-eu.ssl-images-amazon.com/images/I/71Ovtf8xDfL._AC_UL900_SR900,600_.jpg"
B0016ML1C2,"Best Price Square Guitar Pedal, Vintage DELAY VD400 by BEHRINGER",29.00,4.1,25.455,"https://images-eu.ssl-images-amazon.com/images/I/71VOU7+3CmL._AC_UL900_SR900,600_.jpg"
B019EACGSU,"AKG K52 Auriculares de Monitorización de Espalda Cerrada de Alto Rendimiento, Negro",34.90,4.5,14.383,"https://images-eu.ssl-images-amazon.com/images/I/61OnK6q6skL._AC_UL900_SR900,600_.jpg"
B0728GCXFK,"Melódica CAHAYA, Piano de Viento con 32 Teclas, Incluye Tubo de Soplado, Boquilla y Bolsa de Transporte (Negro)",26.48,4.5,4.712,"https://images-eu.ssl-images-amazon.com/images/I/71RVygQ20FL._AC_UL900_SR900,600_.jpg"
B00063678K,"M-Audio SP-2: pedal de sustain universal con acción estilo piano, el accesorio ideal para teclados MIDI, pianos digitales, te",17.90,4.6,25.595,"https://images-eu.ssl-images-amazon.com/images/I/714y7LVpYyL._AC_UL900_SR900,600_.jpg"
B09J2CXPDW,CAHAYA Soporte de Micrófono con Brazo con Dos Pinzas para Microfonos Pie de Micrófono Plegable y Ajustable de 64-158cm para C,29.79,4.4,1.510,"https://images-eu.ssl-images-amazon.com/images/I/61cP4iZ9VOL._AC_UL900_SR900,600_.jpg"
B0002OP0WC,"D'Addario Violin Rosin - Cello Rosin - Natural Rosin Violin, Light",4.76,4.4,8.437,"https://images-eu.ssl-images-amazon.com/images/I/51nFd7QvLcL._AC_UL900_SR900,600_.jpg"
B016Q2CXV4,UGREEN Cable XLR Balanceado Microfono Macho a Hembra Canon DMX para Micrófono Amplificador Altavoz Grabadora Equipo de Sonido,11.99,4.6,9.652,"https://images-eu.ssl-images-amazon.com/images/I/51hYy99uuKL._AC_UL900_SR900,600_.jpg"
B07S7DMXG5,Alpine MusicSafe Pro Tapones de Alta Fidelidad para Conciertos y Reducción de Ruido - Protección Auditiva para Músicos Profes,29.95,4.3,2.379,"https://images-eu.ssl-images-amazon.com/images/I/51WGh7asVgL._AC_UL900_SR900,600_.jpg"
B08121351S,"Silent Mind Juego De Cuencos Tibetanos Diseño Negro Con Mazo De Superficie Doble Y Cojín De Seda Promueve La Paz, La Curación",37.97,4.6,27.335,"https://images-eu.ssl-images-amazon.com/images/I/91rfwnvvn0L._AC_UL900_SR900,600_.jpg"
B07HL1H9JY,"KORG MA-2 - Metrónomo digital de bolsillo con pantalla LCD, azul y negro",15.00,4.5,6.278,"https://images-eu.ssl-images-amazon.com/images/I/61DIqgVcZKL._AC_UL900_SR900,600_.jpg"
B0002PBS7M,"Ernie Ball Regular Slinky Classic Rock n Roll - Cuerdas para guitarra eléctrica, envoltura de níquel puro, calibre 10-46",6.90,4.7,12.267,"https://images-eu.ssl-images-amazon.com/images/I/61V5Hn+r8xL._AC_UL900_SR900,600_.jpg"
B0BW3ZD8N9,"Relota Soporte de Microfono Ajustable, Brazo de Soporte Negro con Filtro Pop, Clip de Micrófono, Shock Mount, 5 Bridas de Cab",16.99,4.3,112,"https://images-eu.ssl-images-amazon.com/images/I/61zXIrENCTL._AC_UL900_SR900,600_.jpg"
B004RB5LUM,"PURE GEWA Tenson F536000, Banquito apoya pie",5.90,4.5,569,"https://images-eu.ssl-images-amazon.com/images/I/610I7cBt8FL._AC_UL900_SR900,600_.jpg"
B006FTEPW4,Adam Hall Cables 3 STAR DMF 1000 - Cable DMX de XLR macho a XLR hembra 10 m,13.68,4.6,2.113,"https://images-eu.ssl-images-amazon.com/images/I/51WPaPHXMkL._AC_UL300_SR300,200_.jpg"
B06Y24JDNC,Winzz Ukelele Soprano Starter Kit para Principiante. Color: Canela Marrón,39.99,4.3,4.059,"https://images-eu.ssl-images-amazon.com/images/I/61hPTqEqG-L._AC_UL300_SR300,200_.jpg"
B084MLBZ9B,Alpine MusicSafe Tapones para los oídos para músicos - Mejora tu experiencia musical con dos filtros intercambiables - Protec,19.95,4.4,1.644,"https://images-eu.ssl-images-amazon.com/images/I/61q9-EL0y8L._AC_UL300_SR300,200_.jpg"
B08CRHB6NM,"Fede Micrófono Karaoke Bluetooth, Microfono Inalámbrico Karaoke Portátil con luz LED Multicolor para Niños Canta Partido Musi",16.79,4.3,7.891,"https://images-eu.ssl-images-amazon.com/images/I/71lNAUOaIYL._AC_UL300_SR300,200_.jpg"
B0002H0FMO,"D'Addario Guitar Strings - Acoustic Guitar Strings - 80/20 Bronze - For 6 String Guitar - Deep, Bright, Projecting Tone - EJ1",8.90,4.5,29.477,"https://images-eu.ssl-images-amazon.com/images/I/818Hwf4Na1L._AC_UL300_SR300,200_.jpg"
B0002E1OX6,"Vandoren SR2125 - Caja de 10 cañas tradicional n.2.5 para saxofón alto, Azul",31.90,4.7,4.107,"https://images-eu.ssl-images-amazon.com/images/I/51pPQ9lW4FL._AC_UL300_SR300,200_.jpg"
B07SHSHW6H,"AGPTEK Micrófono de Solapa con Parabrisas, Z02C Lavalier Micrófono Omnidireccional con 3 Adaptadores, 2M Cable para Smartphon",13.59,3.9,9.089,"https://images-eu.ssl-images-amazon.com/images/I/71JtpdpePAL._AC_UL300_SR300,200_.jpg"
B07BPVJ7RT,CAHAYA Soporte de Madera para Guitarra Nueva Versión Soporte para Guitarra Eléctrica Acústica Clásica Bajo Modelo CY0180,19.99,4.6,3.090,"https://images-eu.ssl-images-amazon.com/images/I/61zbTWOzDLL._AC_UL300_SR300,200_.jpg"
B0886ZPWC8,"AKAI Professional MPK Mini MK3 - Teclado Controlador MIDI USB de 25 Teclas con 8 Drum Pads, 8 Perillas y Software de Producci",85.00,4.7,23.817,"https://images-eu.ssl-images-amazon.com/images/I/717qmGlA7ZL._AC_UL300_SR300,200_.jpg"
B09F3GHFX5,"Nefelibata Correa de guitarra, extremos de cuero genuino, para bajo, guitarra eléctrica y acústica",14.99,4.7,3.129,"https://images-eu.ssl-images-amazon.com/images/I/91gDYfhmuiL._AC_UL300_SR300,200_.jpg"
B0002M6BD6,"Ernie Ball Hybrid Slinky - Cuerdas para bajo eléctrico, entorchado de níquel, calibre 45-105",21.40,4.7,16.180,"https://images-eu.ssl-images-amazon.com/images/I/81lMu0ZTfuL._AC_UL300_SR300,200_.jpg"
B01AKAHF52,SPINCARE Velvet Cleaning Pad Set De Limpieza De Discos De Vinilo LP Antiestático: Almohadilla + Cepillo para Aguja,10.95,4.6,5.082,"https://images-eu.ssl-images-amazon.com/images/I/71j0bmFs6aL._AC_UL300_SR300,200_.jpg"
B0002LI658,"D'Addario Juego de cuerdas para Guitarra Acustica, EZ910 de bronce, 011' - 052'",7.40,4.5,12.696,"https://images-eu.ssl-images-amazon.com/images/I/7102IXCuniL._AC_UL300_SR300,200_.jpg"
B003J30VYU,"PURE GEWA Atril de orquesta, color negro",24.20,4.7,3.942,"https://images-eu.ssl-images-amazon.com/images/I/51LT2rGCTmL._AC_UL300_SR300,200_.jpg"
B0764HD4D4,"Cuerdas de nailon de primera calidad para guitarra clásica, española, cuerdas guitarra flamenca y guitarra acústica BONUS: 4 ",9.99,4.5,7.952,"https://images-eu.ssl-images-amazon.com/images/I/61LAod9iKgL._AC_UL300_SR300,200_.jpg"
B09YXL4VXT,"VLVEE Flauta Dulce Escolar para Principiantes y Niños de 8 Agujeros, Digitación Alemana, Incluye Paquete Externo, Palo de Lim",10.19,4.3,379,"https://images-eu.ssl-images-amazon.com/images/I/61YQB6bElWL._AC_UL300_SR300,200_.jpg"
B0824DX939,"Imelod Kit de limpieza de saxofón con estuche para flauta de clarinete alto tenor y otros instrumentos de viento y madera, in",16.99,4.6,1.300,"https://images-eu.ssl-images-amazon.com/images/I/61khnL0qMSL._AC_UL300_SR300,200_.jpg"
B0BQ3X55VZ,"Genérico Micrófono inalámbrico Bluetooth pequeño de Solapa lavalier con batería para iOS y Android con Adaptador Incluido 2,4",8.99,3.0,55,"https://images-eu.ssl-images-amazon.com/images/I/31eJBJ1e5GL._AC_UL300_SR300,200_.jpg"
B0002Y6BJI,"D'Addario Juego de cuerdas para violín Prelude, escala 4/4 tensión media, Núcleo de acero macizo, tono cálido, económico y du",21.80,4.6,7.494,"https://images-eu.ssl-images-amazon.com/images/I/819Y3RLXeyL._AC_UL300_SR300,200_.jpg"
B00MO1XS5M,Vandoren CR1025 - Caja de 10 cañas tradicional n.2.5 para clarinete,25.50,4.8,4.135,"https://images-eu.ssl-images-amazon.com/images/I/61TKCcU79NL._AC_UL300_SR300,200_.jpg"
